index,post_id,text,time,post_url
153,110908055255420,"大家好，我是陳培瑜。
這十天我有了一個新的工作，我成為了新就任的民主進步黨不分區立法委員。

許多人也許對我陌生，所以讓我自我介紹一下。
在成為一個立法委員之前，我曾經在花蓮美崙開了一間兒童書店，它的名字寓含了我和先生的夢想：凱風卡瑪。

在書店裡，在靠海很近的地方，我把過去在研究所階段和社區工作階段的學習和對生活的想像，都一起放進書店日常當中。我們在書店，把環境永續、閱讀教育、性別多元、親職教育等議題，透過選書也透過講座活動分享給花蓮的孩子、家長及師長。

書店於2013年暫時結束營業，我們返回故鄉台北，在陪伴兩個孩子長大的同時，我以「半媽半Ｘ」的身份，持續與許多學校、家長團體、書店、出版社合作推廣兒童閱讀教育以及親職教育相關工作。

在這段不算短但也還不夠長的台北生活時光中，我一直持續保持著對兒童青少年教育和出版閱讀文化議題的關注和支持。

我接下來也會在立院開議時，先從兒童青少年教育和出版閱讀文化開始，讓培瑜成為孩子們和家長、師長們在國會的力量。",2023-02-15 20:00:06,https://www.facebook.com/peiyu901/posts/pfbid02hsiJZkhDNHFkkb2Tzswg51t1UaCL3YanhyiHgsef2eV6tGXXcBJUJMnu317XvSwfl
290,111898065156419,陳培瑜 updated their profile picture.,2023-02-16 22:40:19,https://www.facebook.com/peiyu901/posts/111898065156419:740947624363507
291,111899621822930,陳培瑜 updated their cover photo.,2023-02-16 22:41:17,https://www.facebook.com/peiyu901/posts/5838807876237087:5838807876237087
213,112556768423882,"今天是我就任立委以來第一次進議場值班，「開學」第一天就親眼見識到國民黨團的無理。
國民黨黨團今天一早占領官員席、發言台與質詢台，阻止行政院長陳建仁的施政報告。

明明可以讓行政院長報告完，再行使立委監督職權去正當質詢，卻上演推翻自己簽署的協商結論，以搶佔議場、惡意杯葛的行為，讓今天受邀向全民報告的陳院長施政報告破局，導致議事空轉。

疫後振興刻不容緩，有許多重大法案也待推動。

國會空轉一天，即是人民的權益被延宕一天。
普發現金不是在菜市場喊價，中央本應考慮資源分配「救急救窮」，請國民黨立委不要再為反而反、爲搏眼球而「誤國害民」。",2023-02-17 18:01:04,https://www.facebook.com/peiyu901/posts/pfbid0N4c4AWGkVX81bJXmvBsDPqbZGQqyf9WE9FTFsYHtCxuPuYbGggMgQUZANJgALWxUl
248,114071684939057,"《半媽半X。下廚日記》
轉換工作的這兩週，廚房變成隊友的空間，照顧著我們。但是需要轉換大腦運作的我，今天早上跟隊友「借用」一下廚房，想要做小時候就跟阿嬤學會的療癒食物—台灣炒米粉、蔭鳳梨雞湯。
是插班生的我，這兩週的學習和體驗，就用這兩道台灣好味來做個小結吧！接下來開議之後，繼續努力💪

#小編不在家
#媽媽立委
#小孩很捧場",2023-02-19 12:07:45,https://www.facebook.com/peiyu901/posts/pfbid0GxRmS754bRScAYwZNb3RUBM9qF7PjVVZ7VCkKa1BQ5suD6fawAchd3QFBZnhp3jKl
121,116051941407698,"普發現金表決立法院今天正式三讀通過，培瑜會繼續在立法院努力監督，加快行政流程，讓民眾盡快拿到現金6000元的經濟果實共享！

另外，很高興疫後特別條例於今日順利三讀通過。

全球政治與經濟局勢帶給台灣許多嚴峻挑戰，中央政策當然得更即時回應社會貼近民意。疫後特別條例就是以「加強經濟及社會韌性」為主軸，加強照顧弱勢族群及提供關懷服務，擴大公共運輸補貼，減輕通勤族交通負擔，強化農業基礎設施，推動因應智慧時代競爭使中小企業升級轉型。

另外，許多年輕人在大學期間會申請就學貸款，然而許多人畢業即負債，初入社會薪資不高，除了負擔生活開銷以外每個月還得固定還款造成不小生活壓力，所以在疫後特別條例也納入學貸減免幫忙年輕人減免學貸，希望讓年輕人及家長們肩膀上少一些壓力！

3800億，不僅用在普發現金六千全民共享，更要在多面向上去強化經濟社會韌性，比方這次涵蓋的居住、青年、農漁產業以及藝文、公共運輸上。

唯有方方面面的盡力去照顧到每一個群體，尤其是社會的基層民眾及弱勢，這個社會才能穩健的向前行。

我也會持續監督，為民眾把關每一筆預算到對的地方去，讓民眾更安心！",2023-02-21 16:28:41,https://facebook.com/peiyu901/posts/116051941407698
146,116893251323567,"台灣性別平等教育協會上週來訪，我們深談許多這些年他們針對孩子推動性別教育的工作成果。我想特別談談，他們如何將「千德爾：彩虹小隊的宇宙冒險」這本關於性別教育的手冊推廣到校園。

「千德爾：彩虹小隊的宇宙冒險」是一本內容豐富的情感教育手冊，裡面共十二堂課，並且性平會貼心的做了十二集的動畫，會連同簡報檔提供給老師，讓這本優秀的性別教育教材推廣到校園。

情感教育是性別平等教育重要的一環，有助於協助青春期學生認識、釐清並解決一些煩惱，然而情感問題沒有一定的解方，我們的情感教育其實與這個世代的需求還有一大段的距離要努力。

建立與他人良好互動，協助溝通與表達，遇到情感挫折擁有調適、紓解，並解決問題的能力，都是情感教育想傳達的核心。

我也期待日後與性平會更多的合作，推動更多有關性別平等、情感教育的議題。性別議題等同人權問題，情感教育則是人類終其一生不能停止的學習。

台灣性別平等教育協會 Tgeea (Taiwan Gender Equity Education Association)",2023-02-22 19:13:18,https://www.facebook.com/peiyu901/posts/pfbid02cySR8D7rpc9mkd5GCFg4Ys92bDRY72wAYZTM9qJsKjZRPobTnFSYuj5rQCUAjkWfl
269,117298291283063,"為教育，不分黨派！
恭喜 范雲委員榮任 10-7教育及文化委員會的召集委員，另外一席則由民眾黨 張其祿委員當選。

身為教育及文化委員會的一份子，期待新的會期超越黨派，為教育、為文化，繼續拼！

范雲  FAN, Yun
張其祿",2023-02-23 12:25:57,https://www.facebook.com/peiyu901/posts/pfbid02GpfynVauFJP4hzeDkaTYu4yf2LGdR4wnwqRnFzmX7NkZP9MqvQXtwD3tzp2XxfxKl
221,117436581269234,"朋友們晚安！我昨天上廣播節目「寶島有意思」，今天晚上七點即將播出，並且會同步上架各大podcast平台。

很高興與主持人靜嫻這次的對談，節目裡會提到我為何選擇投入兒童閱讀與親職教育，以及什麼契機成為立委「跨領域」。

更重要的是，我會談到如何把關注的教育、文化、青少年健康、出版閱讀議題，在有限的時間裡全力推動相關法案，並努力積極爭取。

⬇️
寶島有意思
19：00
北部-寶島新聲 FM98.5
嘉義-嘉義之音 FM91.3
高雄-主人電台 FM96.9
21：00
中部-大千電台 FM99.1",2023-02-23 18:15:03,https://www.facebook.com/peiyu901/posts/pfbid031njkZwF1seBPceBtDamUQQYT1FxVRhqEUDh9vKj3mKwxrkH82UwLy91QY33qp36Zl
45,118120934534132,"公東高工的李恭榮校長，其實是我在擔任實習老師的時候，所認識的朋友。當時他是我的實習指導老師，他認真指導我，讓我在僅有的半年實習歲月中，快速進入狀況。

今天受台東公東高工邀請，到台北世貿去看他們的「溫潤阮ㄟ材」木工家具展覽，也為老師們及學生們加油打氣。

台東公東高工有一個特別的傳承，每個木工科的同學只要升上了二年級，就必須學會親手製作1960年創校以來流傳至今的「公東凳」。而我今天也非常幸運這個展覽看見了這張——保留了錫神父節儉的精神，運用剩餘的木料手工製作拼接出豐富木色的「公東凳」。現場展覽當然不只公東凳，其實還有滿多以台灣疏伐材為主的設計家具作品可以參觀。

公東高工，將學生的實習課與生產結合，並製作成作品販售，自創校以來一直致力於傳承技藝。
他們培育學生不僅身為設計者與製造者，同時也要學會擔任銷售員。

現場同學們為我們導覽解說一件件出自他們巧手的家具作品，我感到驚艷，他們設計跟製作的技術上有多麼純熟，件件都不像是出自於十幾歲年輕朋友的手，從每一個細節就可以看出同學們在學校紮實的技藝培訓。
他們用心地講解木材的年份、製作的工法及他們完成作品的心得，每一件有溫度的作品都擁有故事。

看著穿梭會場忙碌的李恭榮校長及老師們，秉持著初衷投入對偏鄉孩子的教育，即便少子女化的浪潮席捲，招致財務吃緊、資源匱乏，仍舊帶著孩子們辛勤的訓練，這樣的訓練成果也獲得了在今年全國技藝競賽奪得2金1銀3優勝3佳作的傑出表現。

台東有一群優秀的同學們，日日夜夜勤奮的用心製作這些雅緻的家具作品。

我非常推薦大家可以利用228連假，來看在台北世貿中心的「溫潤阮ㄟ材」展覽，也一起為公東高工的老師及同學們加油打打氣",2023-02-24 21:05:49,https://www.facebook.com/peiyu901/posts/pfbid025M369zqSzsSruaibcxQe2mWsUNeUMCYo5rasxo55JtfhxxirNrKqTTm6ebXgggyDl
66,120761830936709,"228連假的第一天剛好在電視上看到烏俄戰爭一週年的紀錄片，孩子們也一起看著討論著，畫面中的人說到這一年中所發生的這一切劇變，也說到難以想像戰爭何時才能停止？四天連假從這個看完紀錄片的早晨開始，這四天幾乎都在家休息，很家常的飲食，很日常的感覺，有陽光的午後時刻，很容易感受到安穩和幸福。

但我們知道如今的幸福日常其實是因為有著許多前人的努力，我們才得以擁有。

這幾年，因為對於繪本的熟悉因此有機會和沃時所承辦的國家人權博物館的人權繪本工作坊合作。在工作坊裡面的課程，有不義遺址的實地走訪，也有受難前輩的真人真事，還有共同閱讀討論的大量的國內外人權議題繪本，繪本內容大多探討言論自由、性別平等、種族多元、民主改革⋯⋯等等。在課程的最後，每一組的夥伴會創作出至少五張圖的故事，目的是讓台灣的創作者自己來說自己土地上的人權故事，透過創作和轉化故事，繪本或許是轉型正義未竟之事的一個小小出口。

除了繪本之外，台灣這幾年有許多好看的書，也為台灣的主體意識和獨立思辨能力的積累提供了許多養份。記得有一次孩子看完《少年台灣史》（周婉窈）之後問我：「台灣的民主自由和多元文化的社會發展，若要往下走，我們好像不能不知道這些歷史？只是我們的課本上真的寫的很簡單耶⋯⋯」的確，以閱讀做為一種時刻警醒和持續投入關心的方法，陪伴小讀者，也幫我們自己「補課」，或許我們才有機會持續捍衛這些得來不易的價值，因為現在享有的自由與民主並非理所當然---坐在家裡和陽光一起讀書的午後，可能一個轉身就不見了！",2023-02-28 14:37:58,https://facebook.com/peiyu901/posts/120761830936709
71,121694480843444,"▍原能會願意增加抽驗檢測頻率，維護食安信心！
▍原能會承諾加強推廣正確資訊，讓臺灣人吃魚吃得放心！

今天我針對2023年日本福島核廠將排放氚水的議題質詢原能會，其中幾項相關要求，獲得原能會承諾會積極辦理。

第一，原能會應更積極推廣「放射性物質海域擴散海洋資訊」，讓更多民眾理解。
第二，原能會應協調相關部門增加抽驗檢測的頻率，讓更多民眾安心。

原能會主委張靜文也承諾，會加強推廣「放射性物質海域擴散海洋資訊平台」。原因是，原能會建置該平台在政府資訊公開的作為上值得讚許，但平台推廣效果卻不佳十分可惜，從111年7月1日開設截至112年3月01日為止，累積流量僅11,869人次。

除了平台，原能會應該採取更多元也更積極的方式去向民眾說明「福島核廠氚水和放射性物質是否會對我國食品安全造成影響」的正確資訊，讓更多人了解氚水和放射性物質是否有殘存在台灣食用海鮮，以及其是否會對人體健康產生影響，減輕民眾擔憂。

此外，原能會應協調相關部門增加抽驗檢測的頻率，尤其國人日常實用海鮮頻率較高，學校、家庭更應該加強注意，除了定期進行抽驗檢測，確保海鮮符合安全標準，更應該加強檢測樣本數，以增加國人對政府維護食安的信心。

福島核電站事故後即將釋放的氚水對台灣的影響是長期而充滿未知的，政府需要積極關注和處理。原能會有責任加強對食品安全的檢測與說明，確保台灣的食品安全、國人健康。

我會持續追蹤這題，讓孩子與爸爸媽媽安心！",2023-03-01 17:20:06,https://www.facebook.com/peiyu901/posts/pfbid0FnVstoz9JtGy5TERK4nLBLNZPf6vWDggJMuKcCRMEYZEjnEfwKsGYa8qUwPrfw45l
64,122616987417860,"今天針對文化部振興計畫進行監督與評估政策成效，首先，我非常肯定文化部此次疫後振興的規劃。只是關於疫後振興，我總相信一定還可以做的更加細緻，為資源分配的效益，也為相關受惠此政策的朋友們，都多想一點。

文化部提到「獨立書店購書加碼」，但是以鄉村地區來說，文化藝術資源本就相對不足，獨立書店、小型藝文消費等也缺乏相應的發展機會。尤其在一些交通相對不便的鄉村，過高的交通時間及花費，恐怕都會削減消費者前往支持的意願。而且，並非所有鄉鎮都有獨立書店。不過，在許多鄉鎮當中都還有許多街口文具型的書店，甚至已經有第二代回來接手經營。這些街口轉角的文具型書店，對很多偏鄉地區來說，是最容易靠近和取得的文化資源，因此我也請部長要放寬認定這些書店，讓他們也可以成為此次振興計畫中的參與店家。

如此，不僅有利於偏鄉地區的書店發展，也提高偏鄉青年使用文化禮金的意願。史哲部長也承諾，會放寬補助獨立書店的範圍，確保政策能夠真正惠及全台灣民眾，達到文化平權的目標。

此外，我也要求文化部必須製作更親民易懂的宣傳文宣，讓民眾能夠知道文化部的美意，也更能促進相關文化產業的復興。部長也承諾，願意重新研擬一份清晰、易懂、讓人們了解實際行動的政策文宣，以減少民眾的困惑，增加五大方案的推動效果。

此外，「藝拍即合」這項計畫上，部長也承諾會與教育部合作，增加更多鄉村地區的校園場次，讓全台的校園文化藝術發展更多元平等！

文化振興計畫要讓全台灣都能被照顧到，我也會持續關心疫後振興的政策執行，讓都市與鄉村地區的文化均衡發展。",2023-03-02 20:29:09,https://facebook.com/peiyu901/posts/122616987417860
275,631058369030590,"① 蔡培慧 慧做事真實在 選前之夜

蔡英文 Tsai Ing-wen 賴清德 立法委員 羅美玲 林靜儀醫師 溫柔堅定新中二 前來相挺，請大家一起分享直播，為南投爭一口氣！",2023-03-03 18:51:49,https://facebook.com/peiyu901/posts/631058369030590
69,125668843779341,"想參訪故宮，該與哪個部門接洽？答案是，偏鄉學生與身障學生有不同的部門。故宮去一般學校辦活動，或者去特教學校辦活動，是同一個部門負責嗎？錯，是不同部門。

今天質詢故宮，對院長提出這些疑問，是希望院長能以兒少的角度更全面的思考，將部門整合統一。偏鄉學生如果想參訪故宮，由「行銷業務處」負責，而身障學生要參訪，卻由「展示服務處」負責。故宮的外部推廣活動職權，也是由這兩個部門「交錯」負責，分工混亂。

我自己也是花了很大的力氣，才搞懂各部門的業務關係，因此，我希望院長能照顧到兒少所有族群，省去繁雜的程序，而院長也承諾在三個月內重新釐清教育推廣業務，「成立專責的教育推廣處」。

我很高興看到故宮博物院從過去到現在，已經在國際化、在地化、多元性、平等性......方面有了諸多努力，包括無障礙參觀服務、性平意識展覽、博物館教育箱及館際聯展等。

當我們談到故宮博物院時，我們談論的不僅是一個博物館。在後疫情時代，越來越多人希望到故宮參觀，尤其是對於這兩年完全停擺的校外教學活動而言，故宮需要更全面的規劃，協助師長、家長、學生等各種教育相關人員，讓兒少可以更深入地體驗故宮典藏文物之美。

蕭宗煌院長今天也承諾研議增設專責的教育推廣處。我相信唯有透過不斷地推廣教育、加強互動、拓展多元化的展示方式，故宮博物院可以讓更多的人民走進這個典藏許多珍貴文物的殿堂，在未來的日子裡，我也會持續關注故宮博物院的發展和進步，並為其盡一份心力。",2023-03-06 18:39:06,https://www.facebook.com/peiyu901/posts/pfbid0252oHE9o5xbt1RjHv5EBRmxvRmkBYP43Vgy74JYPnBefrDUSS64XvszdnJgvDfawul
148,127237333622492,"身為一個媽媽，我很希望我的孩子，不論性別為何，都能在學校安全上廁所，不要遭受霸凌、欺負，不會因為焦慮、壓力不敢如廁。

性別友善廁所是希望 #打造所有孩子的安心廁所，不是隨便把無障礙廁所牌子換一下、或只把男女廁打通就好，而是要有相關設計標準，且必須比過往更加明亮、安全、友善、保護隱私才行！

許多師生使用過「符合標準」性別友善廁所後，都反應良好、表示支持；但未符合標準的，反會造成學生、老師、家長誤解焦慮，且無奈的是，後者比前者還多。

為改善問題，今天我質詢教育部 潘文忠  部長，請部長幫忙推動「符合標準」的性別友善廁所，改善過往不符標準的。

很高興潘部長大力支持，並坦承過去有些學校沒思考到我提的這些必要指標，因此仍有很大進步空間。我提的建議，教育部大方向都支持，也承諾會努力給予更多支持與指引，促使學校、師生了解學習，「廁所對學生來講太重要了，如果能在修建改善的過程中，把性別友善廁所概念放進來，這樣就會雙贏！」

#讓每位孩子都能在校安心上廁所！
#一起和孩子站在同一邊",2023-03-08 17:33:13,https://www.facebook.com/peiyu901/posts/pfbid0pN3yBNQjxg6SYfsGAzegBDdYUK8yJoJXoPmMSjM52kMD5LhPdwxwsfGbNvzMSznNl
123,127267226952836,"#婦女節快樂

婦女節這天，直接響應 生育改革行動聯盟 對台灣孕產現況調查的行動，誠摯地邀請近5年有生育經驗的好朋友們，以匿名填答的方式，幫助生育改革的推動提供寶貴的意見。

多年前生下小狗哥哥的那一天，我在待產床上躺了三天，記憶中除了痛就是冰冷的醫院感。所以當我看到 生育改革行動聯盟 的朋友們在做的事情時，十分感動。尤其是建議建立友善生產環境，提供產家舒適、重視隱私的環境，納入陪產者、營造居家感，並減少非必要性的醫療介入。

此外，產後的支持，像是坐月子，產婦生理及心理照顧的需求，經常被忽略了。這也讓我想起，身邊的媽媽朋友們每每聊起生產後的第一個月，總是淚眼婆娑，還有人說：「為什麼沒有告訴我，養小孩這麼辛苦？睡不飽也吃不好⋯⋯」因此如果透過完整的公共化產後支持，讓每個新生兒的家庭都能得到協助資源，像是荷蘭的產婦在生產完之後，人人可以享有8到10天免費的產後服務。

而為了更了解台灣婦女的孕產現況與需求，生動盟也推出「祝您好生」台灣女人生產經驗大調查。由3/8起至4/8止，大家一起來填寫問卷，作為後續生育改革政策白皮書素材。

生育改革行動聯盟",2023-03-08 18:25:35,https://facebook.com/peiyu901/posts/127267226952836
2,129478433398382,"開幕片《狼女孩的氣候日記》談論了氣候臨界的問題，片中直指，我們這個世代是極有可能目睹人類自身滅亡的世代。因為經濟生產型態百年來的一路前進，無法停止的前進列車，造成了這個世代的無力感。

至於對於下一個世代的兒少來說，他們所面對的不只是環境的問題本身，還有滿滿的對於未來的無希望感。孩子們的確也跟我聊過，弟弟就曾經說過：「學校教的這麼多愛地球和愛環境的論述和行動方案，相對於你們大人的世界還在持續進行的事情和發展來說，會不會無濟於事？也或者，為什麼數十年來的大人們所造成的問題，卻變成我們的考題？不是應該你們大人自己也得學習和一起改變嗎？」

因此在看《狼女孩的氣候日記》時，對於片中女孩的無力感和焦慮，我非但一點也不陌生，想著與孩子曾有過的討論，我相信她的感受和想法，肯定也能引起許多兒少的共鳴。

在想著能更多做一點什麼？從影展開始，讓自己在此議題討論當中，尋找自己的發聲位置和行動方法。接下來，再從自己的工作位置上來用力思考，用眾人之力所能促成的改變一定又會是另一番風景。

#綠色公民行動聯盟
#2023氣候臨界影展
#免費入場現場索票
#狼女孩的氣候日記

綠色公民行動聯盟Green Citizens' Action Alliance
March 9 at 8:57 PM ·

【#氣候臨界影展】 #選片指南 文字紀錄快手分享

明日就要開跑！
各位敲碗的朋友們，晚睡的你有福了！
選片指南現場紀錄快手賴品瑀不藏私分享這邊請享用！

【重點速記摘要區】

・16部作品，有14部作品為台灣首映！
藉由他山之石經驗借鏡省思台灣可行之道，開啟討論與思考。

・因應全球展開氣候行動轉型為「氣候臨界影展」。
除保留既有核能主題，更擴及氣候行動、能源爭議、暖化危機等題材，規劃為五大單元。

・開幕片《 #狼女孩的氣候日記 》巧妙動人的從母女不同心境呈現人類如何看待氣候危機。未來既已遭竊取又何需努力的年輕心聲 V.S. 給不了虛假希望又不想放棄希望的中年母親矛盾。兩場放映也將分別邀請音樂人 #巴奈 、青年氣候行動者 #黃品涵 與紀錄片《日常對話》導演 #黃惠偵 參與映後座談。

・「#核電影 」單元中有著隱藏版開幕片《 #原子能世紀事件簿》，回顧人類在還不理解卻開始濫用原能的黑歷史，特意選映於3月11日，以放映行動回應紀念12年前的 #福島核災 。

・「#世代氣候行動 」單元，呈現9至80歲的行動者容貌，有主角僅9歲的《 #伊芙的森林之家》，每天走出食物、能源皆自給自足的生態村去上學，並面對外界不解，以及《 #諾貝爾阿公的氣候行動》，從得到諾貝爾獎的年邁學者，投身氣候行動，從科學家身份思考人與世界的關係，及如何實際運用知識間的現實提問。

・「#煤電影」單元，觸及煤電退場過程的公正轉型課題，也特別選映《#猴硐煤鄉漫遊》，五支短片串起了猴硐 15 處煤鄉地景，紀錄猴硐老礦工在礦區舊址賣力解說昔日勞動生活的堅毅身影，宛若活歷史的礦工前輩，將於12日映後座談現身分享眼中的昔日景色。

・其中，更有著邀片時遇到導演同時間在進行當地運動，無暇對於影片進行文件作業及影像處理，直接請策展團隊使用既有版本的運動進行式。（請留意看看哪兩部片只在第二週才看得到！）

全文請往下滑，見留言區各種連結傳送門。",2023-03-11 14:46:43,https://facebook.com/peiyu901/posts/129478433398382
