index,post_id,text,time,post_url
3118,180100148994088,張宏陸 updated their profile picture.,2015-10-13 11:47:24,https://www.facebook.com/hunglueball/posts/180100148994088:458950672791738
3172,180100985660671,張宏陸 updated their cover photo.,2015-10-13 11:53:25,https://www.facebook.com/hunglueball/posts/1729127427444530:1729127427444530
416,180175552319881,"(舊文章搬遷)
浮洲合宜住宅在今年4月下旬因為地震，地下室多處梁柱出現裂縫、滲水，引發建築結構安全疑慮；今天(9/7)宏陸再一次”浮洲合宜住宅自救會”成員一同邀請新北市政府工務局長和法制局長來辦公室商討對策，希望能為浮州合宜住宅所有住戶爭取他們的權益。
為保障住戶，目前定調的機制有三大項：
一、 日勝生應對浮洲合宜住宅進行結構補強及後續維修保固，在確保後續修繕完成前不能要求進行交屋，市府也不能發建物使用執照。
二、 日勝生要明確列出修繕補強的清單項目，不能隨口說說而已，而是逐一確實進行後續建築物補強工程，讓住戶監督工程有所依據，住的安心。
三、 因應未來利率基準可能調升，讓住戶因為延後交屋所衍生的房屋貸款調漲多付出的利息，應由市府出面與貸款銀行洽商對策，不能讓住戶因為交屋延後產生利息支出調漲的損失。
未來，宏陸還會一本初衷地繼續關注這事件的發展，用心為浮洲合宜住宅住戶發聲。",2015-10-13 17:29:02,https://www.facebook.com/hunglueball/posts/pfbid0M11JUcZkfD5QiaVNJpYWe8D6LyjtNdBg8voJMECqSp3cLt1L24ndzjhRSMkZD2NUl
1338,180443578959745,"(舊文章搬遷)
2016小豬再起！
總統大選，我們面對的是國民黨數百億的黨產，這是一場艱苦的選戰，我們希望用小豬來號召國人踴躍小額捐款，同時匯集人民的意志和理想。
即日起有200隻粉綠小豬，之後會陸續補充，歡迎麻吉好友們快來索取。
小豬領取地點--------
張宏陸辦公室：板橋區中山路一段293-1號B1
張宏陸服務處：板橋區文化路二段124巷6號1樓
(目前配額僅有200隻，數量有限，每人限領一隻，領完為止，尚請見諒)",2015-10-14 09:20:55,https://www.facebook.com/hunglueball/photos/a.180175562319880/180443578959745/
2299,180455842291852,"大家好，我是張宏陸，這是我成立的新粉絲團，舊的粉絲團已不再更新，請各位鄉親移至新粉絲團。

改變未來，點亮台灣，落實新世代改革需要大家的支持，宏陸懇請大家，支持在地耕耘最久的人選，張宏陸，2016讓我們一起改變新國會！",2015-10-14 10:16:22,https://www.facebook.com/hunglueball/photos/a.180175562319880/180455842291852/
2372,180486598955443,各位鄉親午安，張宏陸行動服務車昨天下午開到四維公園，今天(10/14)下午我們將在第二運動場與大家見面，現場有文山包種茶及小英小豬領取！服務專車早晚將在各大公園及市場服務大家，歡迎大家一起來喝茶聊天談市政！,2015-10-14 12:26:51,https://www.facebook.com/hunglueball/photos/a.180175562319880/180486598955443/
819,180815412255895,"(10/8號舊文章搬遷)
今天我的老長官 蘇貞昌 回來板橋，和宏陸一起在湳興市場掃街拜票。這一刻，讓我感觸良多，記得我當時就是從立委研究助理一路跟著蘇貞昌老縣長，磨練歷經民政局長、板橋市代理市長和新北市議員，一起推動許多新北市和板橋的市政。
在菜市場裡，我們遇到許多熟悉的老面孔，他們都是長期支持我們的好朋友，主動熱情地問候我們，更不時提起稱讚當年蘇縣長在縣府時，用一股「衝衝衝」的態度解決市政問題的效率和態度，這些支持者的熱情與笑容，正是宏陸一路打拼的初衷。
接下來，我會繼續承擔老縣長的期望及鄉親的支持，繼續為新北奉獻心力，更希望大家讓宏陸拚進國會，讓新國會過半，為小英總統落實新世代改革。",2015-10-15 10:11:32,https://www.facebook.com/hunglueball/posts/pfbid0k6U6aLPZ7K6NL5jaCaXdZStK4cLy5pETV3GXqwUmsTf9qC6pKZHury2VTqfk3Hw5l
1667,180837298920373,"各位朋友，宏陸的辦公室現在有蔡英文紀念版小豬，一共有粉紅、粉綠、粉橘三種顏色，只要把普通版小豬養飽，就能換取刻有小英主席簽名的紀念版小豬，歡迎所有鄉親帶小豬回娘家喔!
-----------------------------
紀念版小豬換取地點
張宏陸辦公室：板橋區中山路一段293-1號B1
張宏陸服務處：板橋區文化路二段124巷6號1樓",2015-10-15 11:57:56,https://www.facebook.com/hunglueball/posts/pfbid0ctJVpKWWPGXbWTrb58k72U6UvyH9ct3VSFGKsFmBP4cdG16TaZP4roPPqMLg88P3l
3174,181246692212767,老縣長蘇貞昌今天(10/16)號下午蒞臨宏陸文化路的服務處。,2015-10-16 16:21:39,https://www.facebook.com/hunglueball/photos/a.180175562319880/181246692212767/
2378,182239665446803,昨天宏陸與其他的民進黨黨員一同參加小英主席的募款餐會，現場人山人海座無虛席，到場民眾對於宏陸的演說也都給予熱烈的掌聲，再次地感謝大家的支持，我們一定會加倍努力，明年2016為所有台灣人民帶來幸福安定的生活！,2015-10-19 11:01:11,https://www.facebook.com/hunglueball/posts/pfbid02hvL5QGQoFfkZwL6GLNCV853ronfBL1d4eayUV9mCShVU7KnrYwCouruFo41E9yDzl
1533,183011695369600,"今天是九九重陽節，
忙碌的大家是否撥空打通電話跟家裡的老人家聊聊天呢？

最近，宏陸常常在跑行程的途中，拜會了板橋地方的長老，
地方上的長輩們總是能給宏陸許多寶貴的意見與想法，
對宏陸來說，實在受用無窮，
老人家的生命歷練畢竟比起年輕人多，
對於改善社會現況總能提供不錯的建議，
未來，宏陸都將把這些珍貴的想法列入參選政策裡，
謝謝我們的長輩們，祝福大家身體健康、重陽節愉快！",2015-10-21 15:37:24,https://www.facebook.com/hunglueball/photos/a.180175562319880/183011695369600/
1178,183732275297542,"這幾天因為「鉛管自來水事件」，宏陸常常被焦急的市民詢問板橋地區是否有鉛水管，根據宏陸向北水處內部索取的新北市鉛管資料，在這邊向各位鄉親報告，板橋地區並沒有鉛水管分布，請各位板橋的鄉親放心！

不過為了要讓大家徹底安心，宏陸還是會持續要求新北市府盡速向所有市民公佈詳細的鉛管路段，以及含鉛水利設施的影響地區，讓市民有所防範與警覺，同時補助受影響地區市民的血液檢測費用。雖然板橋地區沒有鉛水管分布，但宏陸會繼續追蹤這個議題，為所有新北市民的健康把關。

#鉛管  #自來水  #水管",2015-10-23 17:21:07,https://www.facebook.com/hunglueball/posts/183732275297542
3084,184510225219747,"缺血中，希望大家踴躍捐血，尤其AB型的朋友，小弟剛捐了500cc。

#捐血",2015-10-25 17:35:18,https://www.facebook.com/hunglueball/posts/pfbid051hkWzkViFeVuu38vqGwUHGVa44gCBkCS4Bwb3hnHDtK28FvU73zJLahzmaYfiBDl
1016,184841351853301,"核電安全一直是全台灣民眾關心的議題，
今天宏陸看到這則新聞，真的覺得很擔心。

綜觀全球，高階核廢料乾貯場皆設在人口稀少，
對生態環境影響小的地區。
但是，馬政府卻草率將乾貯場設在萬里區。

試想，如果乾貯場遇到地震或恐怖攻擊，
那雙北700萬人的生命安全立刻面臨重大威脅。

廢核，是台灣不得不走的路，
台灣是個小國，沒有足夠的國力跟土地承受一次的核事故。

因此，我主張應該積極發展再生能源與提升用電效率，
並透過產業調整逐步邁向非核家園，
讓民眾安心生活在沒有核電威脅的環境下。

#非核家園    #核廢料    #核電",2015-10-26 15:28:07,https://www.facebook.com/hunglueball/posts/184841351853301
2789,186974178306685,宏陸今天和羅致政主委（台灣新力量/羅致政粉絲團）一起到新北市銀髮族俱樂部參加座談會，現場受到長輩們的熱情支持與歡迎，宏陸心中十分感激！,2015-11-01 11:07:40,https://www.facebook.com/hunglueball/posts/pfbid037Uz5pTAUsJjxUFSHMkYEyWLqaWvcKQJk3BXF3voE2c6sRLNgfZeQtqDGnN6frFtMl
1080,187350444935725,"昨天晚上，我和游錫堃院長、羅致政主委（台灣新力量/羅致政粉絲團）、何博文議員（何博文粉絲團）、王淑慧議員 、 余莓莓 、 鍾年晃以及多位里長，社團代表到南天宮參加聯合座談會。

會中談到了我對「12年國教」推行的看法與初衷，我認為12年國教需以免試為主，必須打破明星學校的藩籬，徹底廢除基測，完全免試入學，才能舒緩學童的升學壓力。

除此之外，我認為均衡區域與城鄉教育發展，是當前台灣社會最迫切的事情，因為唯有實現公平的教育機會，才能讓每一個孩子都有公平的起跑點，也唯有透過教育，才能促成台灣社會階級的流動！",2015-11-02 11:30:50,https://www.facebook.com/hunglueball/posts/pfbid022Q7qiUH9hnyu51CMuqkEuUKv51tYyueJYKrGQSbju7TuVyMVVifh1EppVYSqY5t7l
1911,187794814891288,"【張宏陸力推12年國教 免試入學】

我認為12年國教以免試為主，必須打破明星學校的藩籬，徹底廢除基測，完全免試入學，才能舒緩學童的升學壓力。

除此之外，均衡區域與城鄉教育發展，促成階級的流動，讓每一個孩子都能有公平的起跑點，才是目前台灣社會最需要的。願台灣更好，每個孩子有更好的人生！",2015-11-03 18:00:01,https://www.facebook.com/hunglueball/photos/a.180175562319880/187794814891288/
1253,188057634865006,"│民進黨總統參選人蔡英文、板橋西區立法委員參選人張宏陸聯合競選總部成立大會│

各位鄉親大家好，宏陸的競選總部將於１１月１４日星期六早上十點成立， 蔡英文 Tsai Ing-wen 主席跟 蘇貞昌 老縣長當天都會到場，宏陸在這裡誠摯邀請所有支持我的鄉親們一起來參與，為宏陸加油打氣！

時間：１１月１４日(六)10:00
地址：板橋區文化路一段７１號

「點亮台灣，國會過半」需要大家的支持
宏陸邀請您加入改變的行列， 2016支持蔡英文，支持張宏陸！",2015-11-05 11:20:00,https://www.facebook.com/hunglueball/posts/pfbid02Dxo9cMAxSZbm2ztznjc2BDgua4kUqwtFiBmbXobvL8F9ajb3GsMDXjAR6JGDQk5l
389,188435671493869,"去年1129選舉，台灣民眾用選票表現出對國民黨政權的否定，儘管馬總統現在還有半年的任期，但事實上他已經失去民眾信任，成為看守政權的「跛腳總統」。

我認為兩岸之間為了和平發展，必須建立互信建立常態性的溝通管道，這是肯定的。但是馬總統偏偏選在任期將屆、執政黨民調低迷的時候，才與習近平會面。
此舉不但缺乏代表性、必要性，也容易造成憲政危機。

更嚴重的是，過去七年，馬總統在制訂與中國互動政策時一慣黑箱作業模式推動，不但拒絕對媒體與社會大眾公開資訊，也迴避了國會監督，這次的馬習會依然等到媒體揭露後，府方才消極的被動證實，不但違背自己2012年競選連任的承諾，也再一次拒絕大眾及在野黨的監督，這種踐踏民主價值的行為，實在令人髮指。

我在此嚴正要求馬政府與習近平會面前，必須先向立法院報告，並取得國會的同意為前提，只有在資訊完整公開，國會實質監督的情況下，馬英九與中國國家主席習近平的會面才有代表性。",2015-11-05 17:06:00,https://www.facebook.com/hunglueball/posts/pfbid029EDw9Yhiu27W769w3HvQBrV14Lb1tDt4SuQxXUJsrJJwKh8oaSqvUhpn1FA7CyS9l
600,189140541423382,"如果馬習會要成為「歷史的時刻」，必須彰顯出來價值跟觀點上根本的扭轉，並且能夠為兩岸關係帶來正向的改變。我希望今天的馬習會能夠做到下面三點：
第一，在這次的會面中能夠表達出確保台灣人民的選擇權的態度，表達對民主價值的尊重，這就是維持現狀、維持台灣民主自由的現狀。
第二，要能夠展現出一個精神，對於兩岸的和平穩定發展的追求，是不需要有政治前提，是不預設任何的條件。因為，沒有預設條件的和平，才是發自內心的和平；不需要政治前提的交往，才是真心誠意的交往。
第三，一定要維持雙方的對等尊嚴。
如果能夠做到這三點，才是真正的「歷史時刻」，這樣才是一個可長可久的兩岸關係的開始，也才會符合人民跟國際社會的期待。所以，能不能達到這些，我們將拭目以待，我要再一次的提醒馬總統，如果做不到這些，台灣人民會很失望。",2015-11-07 17:13:21,https://www.facebook.com/hunglueball/posts/189140541423382
2477,189155878088515,今天宏陸的辦公室來的一群特別的客人-宜蘭縣長 林聰賢、員山鄉長江永和以及新北市宜蘭同鄉會特地帶了蔥和蒜(蔥滿勝蒜)來宏陸的辦公室為我加油打氣，有了林縣長的鼓勵與打氣，宏陸一定會更加努力！,2015-11-07 18:15:23,https://www.facebook.com/hunglueball/posts/pfbid02PwNaBZ41Usxss6HqHvJ147x5sVoYkAR93Nfqh5yf1XtszEQgEAFeYPD4CUC7dffql
2224,189264231411013,我們很遺憾，馬習會唯一達成的效果，是在國際舞台上，企圖用政治框架，框限未來在兩岸關係上人民的選擇。今天早上，我們期許馬總統為台灣人民做的三件事情，包括確保兩千三百萬台灣人民的選擇權、交往沒有政治前提，以及對等尊嚴，他一件都沒有做到。,2015-11-07 23:37:49,https://www.facebook.com/hunglueball/posts/189264231411013
1332,190846841252752,"【線上小額捐款】
您的點滴支持 是我們前進的力量 

各位鄉親，這次選舉我們面對的是財力雄厚，背後有財團與數百億黨產支持的對手，而我們的資源十分有限，將每一分錢花在刀口上。如果您認同宏陸的理念，願意與我們攜手改變未來，現在動動手指即可傳遞最實際的支持。 

只要透過以下連結，或者按下粉絲團封面照片上的「使用應用程式」就可進行捐款，不限金額多或少，有了您的點滴支持，宏陸更能無後顧之憂往前邁進，讓國會過半、以進步的力量改變政府！",2015-11-12 11:30:00,https://www.facebook.com/hunglueball/posts/190846841252752
1189,190909604579809,"│ 蔡英文 Tsai Ing-wen X 張宏陸 板橋西區聯合競選總部成立大會│  

就在明天！誠摯邀請您蒞臨參與！ 
 
各位鄉親，為了拼國會過半 為了讓台灣改革有希望，小英總統與我的聯合競選總部將於明天(11月14號)早上10點成立，小英總統、 蘇貞昌院長、 游錫堃院長、 余天委員都會親臨現場。歡迎大家相約親朋好友一起來參加，為我們加油，一起點亮台灣，完成歷史性改革！  
 
 
時間：11/14(六) 早上 10:00 開始  
總部地點：板橋文化路一段71號",2015-11-13 11:45:00,https://www.facebook.com/hunglueball/posts/pfbid0j9eMqq9nuhaDKDSKJhPd9wsZZwShgK66sDE957rPm4s8wFQQAgWsdcfm1p4Gy4A8l
1466,191612617842841,"宏陸跟 蔡英文 Tsai Ing-wen主席的聯合競選總部成立大會順利圓滿完成！
現場滿滿的人潮，令我非常感動。感謝特別撥空前來的蘇貞昌老縣長、台灣水牛游錫堃院長、吳秉叡委員、台灣新力量/羅致政粉絲團主委、 何博文議員、以及板橋在地幾十位里長大力相挺，對於冒雨在台下熱情全程參與的眾多鄉親，宏陸心中更是充滿感激。
我承諾不會辜負大家的期待，做名真正代表民意的立委，與小英總統一同點亮台灣未來！",2015-11-14 18:04:50,https://www.facebook.com/hunglueball/posts/pfbid02UTNHXkfLeBPmGCtMRHAanj8G2SSpsUfnocgkoe1eWgK8q1rQrTF4dqF7V7gUjitAl
2025,191877447816358,"台灣棒球，真正讚！
昨天晚上台灣人都經歷了欣喜的一晚，台灣隊贏了強敵古巴！
棒球是我們的國球，透過球賽所有台灣人都凝聚在同一個信仰下，感謝所有球員們的努力讓大家擁有了團結、快樂、難忘的棒球之夜！接下來還有比賽，還有許多實力堅強的對手要面對，希望大家繼續為台灣隊加油喔！",2015-11-15 10:00:53,https://www.facebook.com/hunglueball/photos/a.180175562319880/191877447816358/
2589,191208781216558,這是宏陸的競選小巴，相信有不少板橋地區的民眾都有看過。這些日子以來，它將宏陸的參選政見帶進每個里，走入板橋地區民眾的心。希望我們一起為台灣的未來加油，點亮板橋、點亮台灣！,2015-11-15 12:49:00,https://www.facebook.com/hunglueball/posts/pfbid025VYtEDfmB2eD3jnjoZvZKiQgaTEdNfZPt4af6RxaVqi1hRoyz1TKrkB9YmQSyxZPl
873,192251904445579,"【投票倒數60天】透過神聖的一票，我們可以改變未來！  
宏陸在外面跑行程時，許多鄉親都告訴我，他們很煩惱也很憂心我們國家的未來，產業外移、經濟衰退、治安惡化、公共建設停滯，連吃的食物都不安全，年輕人面對高不可及的房價，只能望洋興歎。  
我們熱愛的國家正處在最艱困的時代，替人民解決問題是政府存在的目的，但是現在的政府卻未盡到責任。  
人民是國家的主人，立法委員負起監督政府、落實民意、實現改革的重責大任。面對失能、無能的政府，我們還有民主的選舉制度，明年1月16日是重要的日子，唯有透過手中的選票，展現自己的意志，才能反轉未來，2月1日新國會的誕生就是改革的起點！",2015-11-17 11:30:01,https://www.facebook.com/hunglueball/photos/a.180175562319880/192251904445579/
2422,192728187731284,"今天傍晚，宏陸和電火球院長蘇貞昌一起參加里長暨地方社團領袖座談會。

貼近社會、衝衝衝勤跑、傾聽所有人的聲音，是蘇院長教我最重要的事，面對財力豐富、實力堅強的對手，宏陸能做的，只有比別人更打拼而已。",2015-11-17 18:44:52,https://www.facebook.com/hunglueball/posts/pfbid0fAfZDBtTQWAGRhtcVND3FeC5bg1gLxwGPg2EPbtRvnuqzuZcPCRAdD2pX1Gt7DXhl
1315,193355497668553,"感謝 吳秉叡委員對宏陸的支持。

如同委員說的一樣，板橋雖然小，可是人口非常多，經營起來並不輕鬆，但能看見鄉親因為宏陸的服務而心滿意足的表情，一切都值得了，鄉親們的笑容與熱情，正是宏陸在板橋耕耘多年最大的動力。

宏陸和秉叡委員一起在蘇貞昌老縣長底下共事多年，他是一個問政極為認真，對新北市有許多理想與期許的委員，希望以後再跟秉叡委員一起共事，在立院為新北市的鄉親服務。

請新莊的朋友們一起支持問政最認真，評鑑第一名的立委吳秉叡！",2015-11-19 16:23:55,https://www.facebook.com/hunglueball/posts/193355497668553
1,193381934332576,"昨晚，宏陸應 革命議會 Revolution Congress的邀請，參與了青年微創業系列講座『如何當一個台灣漫畫家』，這次的講師是著名政治諷刺漫畫「馬皇降臨」的作者韋宗成老師，我過去在09年時閱讀「馬皇降臨」這部作品時，就對於其諷刺當下政壇時事的KUSO內容相當印象深刻。後來知道韋宗成老師又創作了以台灣民間長年最虔誠信仰的媽祖娘娘為主角的長篇少年漫畫作品「冥戰錄」，拜讀之後，深深被其劇情和構圖畫面吸引，故事中不但出現西門町、三峽老街、……等等你我都熟悉的街道畫面，各種神怪角色也都是台灣過去特有的民間傳說。看了這幾部作品之後讓我深深相信，台灣的漫畫產業，即使在面對國外的眾多作品之下，仍然可以在市場上走出一條自己的路。

聽完韋宗成老師的演講和許多參與民眾的提問之後，主持人革命議會理事長王奕凱邀請我上前致詞，身為一個喜愛閱讀漫畫的讀者，又作為一個民意代表，前幾日在接到邀請之時，我就在思索，政府單位和民意代表究竟能給台灣的漫畫產業什麼實際幫助呢？

我想起過去在板橋代理市長任內，看見市內中正路上荒廢多年的退輔會訓練中心，即爭取經費打造成現在的「板橋435藝文特區」，除了讓市民多了一個藝文休閒場所之外，也提供給更多本土文創產業相關展出之用，希望未來也能在435藝文特區內看見更多台灣傑出漫畫家的作品展覽。

還記得從早期的「烏龍院」，到二十幾年前的「一刀傳」，接下來像是「頑劣家族」，到現在韋宗成老師的「馬皇降臨」和「六都爭霸」等，這麼多具有台灣特色的作品，我相信政府只要多獎勵使用台灣特有文化元素來創造本土作品的作家，就能使台灣漫畫的文創產業在市場營銷跟推廣上走出自己的一片天地。

我認為政府單位對於漫畫產業整體補助的預算經費，應該把舞台做大，例如可以一年最少兩場大型漫畫創作獎勵比賽，比賽內容可以再依投稿作者來分級，比如建立年度新人獎、年度長青獎、開放讀者投票的最受歡迎獎……等等。

而市場上各通路銷量長紅的前幾名本土漫畫家創作作品，政府單位應該協助其行銷與曝光，邀請這些優秀作者授權作品角色來為各政府單位政令宣導做結合創作，不但增加作家優良作品的曝光度，也讓政府的政令宣導更加親民，創造出低成本但政府單位和漫畫家雙贏的效果。

而全球網路普及之下，實體書包括實體漫畫書銷售量會越來越少，走向電子媒體是未來的趨勢，未來的文創產業逐漸大量走向電子書形式也是必然，但台灣目前仍然沒有一個政府官方的電子市場平台，各通路或出版社業者只在自己建制的網路平台上連載自家出版社的作品，最終幾乎都走入業者惡性競爭，不但政府沒有得到正常稅收，反而讓盜版品猖獗。我建議政府相關單位未來可以聯合各漫畫出版社業者和漫畫協會成立官方電子平台，由官方平台建立合理規範分級並出版付費式文創或漫畫電子書，不但政府可有合理稅收，業者也更容易統一經營網路媒體，對於消費的民眾也有長期保障。

就像前面說的，我認為政府應該把餅把市場用正確的方法做大，讓更多的優秀漫畫作者可以有舞台發揮，有更多曝光度能得到讀者肯定，進而創作更多好作品來鞏固整個台灣漫畫產業。

日本、韓國、歐美等國家的漫畫都擁有自己長年的文化，台灣當然也有許多自己固有的文化素材可以創作，宏陸衷心希望未來的台灣本土漫畫產業能夠更加茁壯，讓更多讀者在休閒閱讀之餘，能在眾多優良作品中看見自己居住的國家文化面貌，也在閱讀漫畫中能建立起屬於我們自己的土地認同。

台灣加油！也希望大家一起為台灣本土漫畫產業加油！",2015-11-19 18:44:40,https://www.facebook.com/hunglueball/posts/pfbid0CZk9WfMRZcXbujnANaJFPtUVrbrA1yfYq8XKbvsEe9waodJ3kSptfRihHMQhmunJl
673,193637197640383,"昨天台灣聖騎士，副總統候選人陳建仁來到板橋農會，為宏陸和 致政(台灣新力量/羅致政粉絲團)，張羅二人組站台！

陳建仁先生是知名台灣流行病學者，曾任中央研究院副院長，2003年SARS疫情爆發期間，他臨危受命出任衛生署署長，招集專家學者針對疫情特性制定出一系列嚴密的應變方案追蹤及隔離所有的病人與接觸者，使得SARS疫情在最短時間獲得控制，最終完全消失。

知道陳副院長蒞臨，許多支持者慕名而來，面對支持者的熱情握手、簽名要求，副院長都來者不拒，並主動伸出手抱支持者的小孩，要大家以後可以叫他「大仁哥」。從民眾的歡呼聲以及採訪媒體的陣容來看，「大仁哥」的超人氣與魅力確實不同凡響。

有了陳建仁先生這麼優秀的人才，與小英總統一起打拚，宏陸相信台灣未來一定有希望！",2015-11-20 12:33:01,https://www.facebook.com/hunglueball/posts/pfbid0NmLTbkPgNu1kRiyqkXfTrsEi8tT2dKJRahEFc7XxnRKWVAQ8JQct5qNRfPsW1bZgl
1093,193625764308193,"【板橋好停車】
闢建地下停車場 終結違停惡夢
如果您是生活在板橋的朋友，應該會對板橋交通問題特別有感，板橋地狹人稠，許多鄰里社區沒有停車場，加上捷運線施工讓既有道路狹窄，不僅造成交通打結，違規停車的問題也相當嚴重。
 
讓每個有車的市民，都能有停車的地方，是張宏陸對市民的承諾。宏陸主張在不影響學生學習、市民遊憩休閒的前提下，爭取全面利用校園操場、公園綠地來闢建地下停車場，並提供周遭鄰里社區住戶停車租金優惠，藉此減少違規停車，讓板橋交通大暢通、市民停車沒煩惱，滿足板橋人對交通通順以及生活品質的渴望。",2015-11-21 11:24:01,https://www.facebook.com/hunglueball/posts/pfbid029C9ZSTiuRTwXDe5eP21wpX5YgrUVZoDdkgG4fn4MiPpa9CDriUU9MR6ZbJPNAWoDl
