index,post_id,text,time,post_url
32,1691393157552089,"今天，外交國防委員會談的議題是「新南向政策的推動」，其實國書一直認為，在面對外交困境的時候，體育外交就是很棒的軟性外交方式，但是很遺憾的，在今天教育部的報告中，我們卻完全沒看到教育部在這一點上面有任何的著墨，真的很可惜。

其實，要提升國家的知名度，除了各種經濟貿易交流以外，一個知名的球星、一支堅強的國家隊，都是可以協助我們打入當地社會的利器。例如，印尼跟馬來西亞的民眾可能不認識蔡英文總統，但他們會知道我們有一個戴資穎；就像我們不一定知道阿根廷總統是誰，但我們會知道阿根廷有一個梅西，又好比我們不一定知道多明尼加在哪裡，但我們會因為棒球所以知道世界上有多明尼加這個國家。

在今年國慶日在台北有一場亞洲盃的資格賽，台灣神奇的逆轉了曾經得過亞洲盃第四名的巴林，那個晚上，台灣震驚了亞洲足壇，更是讓亞洲看見台灣。這場比賽，可以說是將士用命，其中最關鍵的，就是從2011年因為我們熱心球迷陳家銘的協助，幫台灣邀請回來的台裔比利時球員陳昌源，在他加入台灣國家隊之後，只要有他出賽的比賽，台灣國家隊勝率高達五成，只要他有進球，就是台灣的勝利保證，也讓我們從亞洲弱旅，一路攀升到這個月我們創下了近年來的世界排名新高143。但是很可惜，他今年就要退役了。

而為了為國舉才，一樣是在熱心球迷的穿針引線下，我們發現還有一個優秀的華裔球員，是目前在歐洲頂級聯賽蘇超效力的周定洋，從六月份我們辦公室與劉世芳委員辦公室招開記者會開始，現場與會的外交部、體育署、內政部官員也都說要大力幫忙，中間為了幫他完成相關的身分驗證程序，我們跟各部會開了六七次會議，甚至還跑到了中國去幫他辦理相關的文件。但是，因為內政部最後才又要求周定洋在英國的文件需要驗證，以至於他趕不上十月份國慶日的比賽，還好，十月這場比賽我們還是贏了。但是，隨著陳昌源傳出要退役的消息，能不能補強周定洋就更為重要。

於是今天，我再次替台灣足球界向外交部請命，目前周定洋的入籍程序，就只剩下他在英國的文件需要驗證。但是，因為目前正值球季，球員真的沒有辦法去處理這些公文往返。
感謝李大維部長的重視與允諾，國書也要強調，如果是我們國家希望可以邀請到這樣的選手回來為國效力，那麼，就不應該以各種文書業務讓優秀選手被拒於門外，政府應該更主動的專案處理這最後的一哩路，協調並加速驗證程序，讓他可以趕得上我們11/14客場對土庫曼，攸關亞洲盃晉級的比賽！

質詢影片：http://ivod.ly.gov.tw/Play/VOD/101193/1M/N",2017-10-18 18:00:18,https://www.facebook.com/permalink.php?story_fbid=pfbid02JH64LobgV43bdoTcv1FwKr6GPV6JtfTghfmjT2TeTfmX2R6NT3pnwS1kmJB3opWul&id=566381323386617
1136,1692441470780591,"今天，很榮幸可以受到胡忠信大哥的邀請，到《新聞大解讀》的節目中，與同樣是文化議員的 王立任以及我的辦公室副主任焦佳弘，一同分享國書從市議員時期一路以來推動的文資保存工作，還有國民體育法修正過程中我與幕僚團隊在推動上的甘苦談。

歡迎各位朋友晚上八點打開民視台灣台，一起來收看！
#民視新聞台凌晨一點半重播
#手機下載四季線上影視app也可觀看
#也可以直接點這裡觀看線上直播↓
https://news.ftv.com.tw/live/live-video/1/4gtv-4gtv001",2017-10-19 19:00:05,https://www.facebook.com/permalink.php?story_fbid=pfbid0ctXDTCJFvFZFVmtFH1Lydm6fSokC9rH4LzzqziS7VSFmi65TyqCcsWN6Deg8mbJol&id=566381323386617
48,1693825107308894,"全民參與是國體法規範，請少數單項協會莫再抵抗；
但選舉是團體自治範疇，請署長恪守事務官分際切勿以個人意志逾越法律授權！

經過了長達一年的醞釀、折衝與討論，為了回應社會對於台灣單項協會應走向民主化、透明化、現代化的期待，國民體育法的全文修正案在上個月的今天正式經由總統府公告。

但令人遺憾的是，本應逐步上路的體育改革，卻因為署長英雄主義式的作風，風波不斷。做為國體法修正的主提案人之一，國書必須再次強調，國體法的修正，並不是為了要針對任何單項協會，而是立法院為符合社會公益，以法律位階對單項協會進行了必要的制度調整，好讓台灣的單項協會可以更多元參與，貼近民意，真正走向現代化並開啟運動產業的可能。

因此在這幾天署長引起風波的「全民參與、理事長直選」發言中，國書認為，其實「全民參與」本來就是國體法第三十二條的條文內容，並非林德福署長獨創，因此各單項協會此刻應該要做的，不是抵抗，而是應該要開始積極配合修法，迎接新血的加入。

然而，在林德福署長要求各單項協會應「理事長直選」的部分，國書認為，在憲法保障人民集會結社自由的同時，除非法有明定，不然任何行政機關都不應該去干涉團體自治，而體育署提出的釋字733號釋文也沒有提到行政機關可指定團體選舉方式。對於協會直選理事長，國書支持並且肯定，但是，如果這是由體育署長單向的指定，又無國體法的條文授權，我相信，以署長長年以來事務官的經歷，應該很清楚這部分將會衍生的風險與疑慮。

在這邊國書要再一次重申，我支持協會直選制度，但這應該是由團體自決的結果，而不是由體育署以官方新聞稿進行要求。正因為台灣是法治國家，所以縱使各單項協會在社會上觀感或有不佳，我們還是選擇了以修法去改善制度，而非直接訴諸民意以行政去干預團體自治。如果體育署認為理事長直選是必要的，我也樂見體育署主動報請行政院提案再次修正國民體育法，新增關於「理事長應由直選產生」的條文。

體育改革的成功是全民期待，在這邊國書也要呼籲，體育署請更積極的公開透明的方式，讓社會大眾與體育界的朋友了解體育改革的辦理進度以及相關會議內容。別忘了，除了長期封閉保守的單項協會的黑箱需要打開以外，體育署的現代化與國手權益的照顧，也一樣還在改革的道路上。",2017-10-20 23:46:31,https://www.facebook.com/permalink.php?story_fbid=pfbid02vs3JEe6ghh8sUv6fyR75Abwn9AEcck1BRPkGGC13wyzQpprw75RdDWTf3HDtquBgl&id=566381323386617
1053,1697730010251737,"讓老師留下來　偏鄉教育條例審查就在明天！

從去年六月國書在教育委員會召委任期，率先提出「偏鄉教育條例」草案，並安排公辦公聽會，要求教育部應該盡快完成院版條文。經過了一年多的醞釀，在國書與行政院版的基礎上，立法院也陸續累積了一共十二個版本的草案等待審查。

趁著院會的空檔，繼續來研讀十二個偏鄉教育條例草案版本，尋找對偏鄉最有利的選項。但是國書相信無論是朝野哪個委員的版本，大家關懷偏鄉教育的心意是一致的。讓我們一起加油，在明天一起把「偏鄉教育條例」送出委員會，讓偏鄉的孩子們不必再問「老師，你會不會回來」！",2017-10-24 17:30:35,https://www.facebook.com/permalink.php?story_fbid=pfbid0366Vp8KZgVvucUdF9Rs3jcx77ZBFFudUffcQxL9HA3qYpyyy5yh9AcxijgEZCA6eZl&id=566381323386617
593,1698686376822767,"華裔足球好手周定洋國籍認定取得，距離代表台灣出賽身分只差最後一步！

今天中午在審查偏鄉教育條例的同時，接獲內政部關於周定洋國籍認定公文核發的消息，內心真的是無比振奮。

感謝熱心的球迷朋友GINOLA、體發會余政憲副召集、劉世芳-高雄芳城市委員、總統府姚人多秘書長、內政部葉俊榮部長、外交部李大維部長以及內政部戶政司、外交部領事事務局、歐洲司、海基會全體同仁的協助，讓周定洋取得中華民國護照相關的程序又向前推進了一大步。

不過，國書還是要強調，邀請到華裔好手歸國，雖然是提升國家體育競技實力的努力方向，但如何厚植我們基層的環境，善待選手並提升整體體育環境，更是體育署該去努力的方向，我會繼續監督，也請體育署不能總是被動等待來自民間的努力。

歡迎周定洋，從今天開始，我們就是同一國的了！",2017-10-25 14:20:58,https://www.facebook.com/permalink.php?story_fbid=pfbid02rMovZrmn3XkhD9cQbQZVTMPwp5VJFXnfMbfgNb2y4jMmBKtp3MtHmFFsqhi3Zn4Hl&id=566381323386617
89,1700412093316862,"邀請華裔選手只是強心針，厚植基層發展才是正道！

雖然成功完成了協助華裔好手周定洋取得國籍的超級任務，但是國書還是認為，真正厚植台灣的運動環境才是體育發展的硬道理。

國書必須強調，發展運動不是靠撒錢就好，回顧2003年體委會砸下1650萬元，獎勵首屆全國大專甲組足球聯賽的男足前三名學校，兩個月內踢12場比賽就能贏取上千萬元，成台灣體壇空前，也是成絕後的「千萬運動聯賽」。這個驚動體壇，引起其他單項抗議體委會獨厚大專男足，就連當年的足球界也不認同，更不要說當時所提出的「足球元年」至今仍然是笑話一則。
 
其實，政府對於足球的發展其實沒有少過，我們從99年開始「大足球中程計畫」、「足球中程計畫」提撥了大筆的經費到足球運動、最近又傳出體育署長要提出「10年40億前進世界前百」的計畫。

的確，體育發展需要經費，但我們更要去看有沒有用對方向，我們的足球環境真的改善了嗎？足球發展的斷層，體育署有看見嗎？從民國九十六年到今年，國小的球隊少了400隊。花蓮在小學階段只剩下六支學校球隊。而在台中，我們女足有雙十國中、五權國中這些優秀的基層球隊，今年更拿到全國第二，但台中現在已經沒有任何一支高中女足了。

沒有基層，何來拔尖？國書認為，體育署應該翻轉「體育班掛帥」觀念，透過學校體育社團化的策略，鼓勵一般學校也籌設足球隊，這才能夠真正達到厚植基層的效果！

新聞報導：
https://udn.com/news/story/6656/2780068
http://www.appledaily.com.tw/realtimenews/article/new/20171026/1229350/
質詢影片：
http://ivod.ly.gov.tw/Play/VOD/101732/1M/N",2017-10-26 22:56:59,https://www.facebook.com/permalink.php?story_fbid=pfbid022avvcXzqcW7vbjszeVTcJZNmg4iFWTAKJD9aXdd8aAKqRdNCkZfTptN2yoWzHXJFl&id=566381323386617
3085,1703204099704328,天剛亮，台中馬拉松賽鳴槍起跑!,2017-10-29 12:40:48,https://www.facebook.com/permalink.php?story_fbid=pfbid02xeMSNN5UwUF2Rx5nPvbtRJaJzvHRoN2DQH378DEDNgvpQnHZLvGVTxUUW3ALPntzl&id=566381323386617
1715,1704749299549808,"歡迎周定洋！

經過我們多次的奔走協調，終於讓華裔英籍球星周定洋可以代表台灣足球隊出賽!

國書也要感謝本次入籍過程中海基會、內政部、外交部第一線同仁以及 體發會 余政憲副召集人、  劉世芳-高雄芳城市委員、總統府姚人多秘書長的協助，葉俊榮部長、李大維部長的通力支援。

繼續向睽違了近五十年的亞洲盃足球會內賽前進！
(照片由駐英代表處提供)",2017-10-30 22:15:32,https://www.facebook.com/permalink.php?story_fbid=pfbid0ViYJMEWhm3CAdt7wgBhQxQ9Edi6jsrcB583mbEgiAKRX6TTS8Rm6oT3m6rg2keXEl&id=566381323386617
545,1706420806049324,"加入單項運動協會民眾預報名〝第一波〞人數公告出爐，關心體育的朋友，你登記了嗎？

根據體育署的整理，目前的報名狀況是棒球協會917人網球協會 835人、足球協會 806人。

從推動體育改革國書不斷的強調，改革不只是修法，體育署的效能提升，單項協會的全民參與都是讓台灣體育環境走向公開透明與現代化的關鍵，距離12/20報名的截止還有一個半月，歡迎大家一起透過實際加入，讓我們一起幫台灣體育發展升級！

各單項協會入會報名網址：
https://portal.cloud.sa.gov.tw/PeopleApply/PeopleApply
體育署民眾申請加入特定體育團體會員報名人數統計:
http://www.sa.gov.tw/wSite/public/Attachment/f1509501557775.pdf",2017-11-01 11:28:04,https://www.facebook.com/permalink.php?story_fbid=pfbid02DQfrQhrVim9zGBa3uP7LWEGcPX4KkPUk14UPqChy35vfxtRynuZZu8FWGbqdjn5Tl&id=566381323386617
682,1706706232687448,"偏鄉教育條例初審通過！

從國書去年六月份率先提案、以召委的身分安排詢答、公聽會，經過了一年半的醞釀與等待，我們終於在今天盼到了「偏遠地區學校教育發展條例草案」在立法院教育委員會初審通過。

國書出身自南投，對於偏鄉教育所面對到的困境，感受自然又更加深刻。因此，如何透過專法的設計，為有志於偏鄉教育的年輕人打造更友善的環境、讓偏鄉教育資源能夠不再只是期待有今年沒明年的計畫型補助，是我對於這部法案的初衷。

雖然，在最終通過的版本中，師資問題的過份強調，似乎模糊了我們最原初對於問題的關懷，但國書還是期待，透過這部專法的設計，可以為我們失速中的偏鄉教育環境踩上煞車。謹以這部法案獻給每一位在第一線從事偏鄉教育的朋友，改善偏鄉教育環境，我們一起加油！",2017-11-01 18:54:47,https://www.facebook.com/permalink.php?story_fbid=pfbid0oyDuFtuwNfxbteYeTH3dUSNbzsMu7ALctL74j2u2VLMhrVmDAbovstYQcin8dRM1l&id=566381323386617
176,1707639882594083,"面對演唱會主辦單位惡意倒閉 文化部應更主動捍衛歌迷權益！

今天，國書以最近許多歌迷期待的「紅髮艾德」來台演唱會，因為延期舉辦所衍生出的退票問題，向鄭麗君部長提出質詢。

隨著影視音產業的發展，大型演唱會的舉辦已經成為了當代音樂產業的精華所在。例如五月天的演唱會，每場門票收入都是超越千萬，然而，面對少數不肖業者，透過設置空頭公司、或是惡意倒閉，造成歌迷求助無門的問題。

國書知道，每一張動輒上千甚至近萬的門票，都是歌迷們辛苦的勞動成果，而我也理解，目前關於演唱會的辦理與相關糾紛，主要是由消保處在處理。

但是我必須強調，影視音產業的最珍貴的就是歌迷的支持，而對於消費者的保護，文化部其實是可以再往前做一步。以2013年史密斯飛船演唱會因為主辦單位惡意倒閉為例，據說到最後光公演版稅就欠了幾百萬，同時，又利用「先演出、後付款」的慣例，逃避權利金，更是造成產業從業人員很大的衝擊。

因此，對於這種類型的展演，我也建議文化部可以透過跨部會協調，研議履約保證相關的機制朝下列方向努力：

1、與消保會討論如何建立演唱會票務履保制度。
2、建議場地單位出借前應要求演出商出具演出者的授權書，為歌迷權益做到雙重保障。

感謝鄭麗君部長正面回應將會研議相關保險制度，國書希望文化部可以展現政府的積極，讓我們的歌迷們可以不再需要去去承受這種不必要的風險！",2017-11-02 16:24:18,https://www.facebook.com/permalink.php?story_fbid=pfbid0PfsEAU4NmLKUphDPuB5ejzSWtBznx47rhqjSamgKvWdafdpHJm2NzfBJRhDMG7PAl&id=566381323386617
63,1711777372180334,"民眾加入特定協會網頁一直都在 體總早就無管理權！
http://sports.ltn.com.tw/news/breakingnews/2243568

早在今年九月體育署私下以三十萬補助款與體總合作架設民眾報名單項協會入會網站時，國書就曾提醒體育署，中華體總資安能力有限，且又與單項協會牽連甚深，實不宜作為報名平台。因此，體育署當時雖仍不斷強調體育總會的重要，但也隨即將報名平台之資料庫移回體育署。

對照這兩天，中華體總與少數單項協會理事長大動作的向體育署喊話，並宣稱＂民眾網路報名無效、已申請加入作廢＂等言論，國書也很好奇，對於手上沒有的資料，體總要如何做廢？而未經各單項協會理事會討論的報名，體總又是在什麼法理基礎上宣布無效？（體育署聲明:http://www.sa.gov.tw/wSite/ct?xItem=35761&ctNode=300&mp=11 ）

不同於中華奧會因其國際身分，在治理上多受奧會規範所保障，中華體總在歷次的虛級化之後，目前實際上就等同於各單項協會理事長的聯誼性組織。也因此，在今年五月份「國民體育法」審查討論中，體育署希望將中華體總等文字入法時，國書即主張不應採用體育署版文字，讓中華體育總會得到法律位階的存在保證。國書認為，國民體育法修正的目的，就是希望可以讓各單項協會得以走向公開透明，但倘若讓沒有民主機制、透明監督的中華體總，透過國民體育法取得法律授權，勢必又會衍生更多爭議。

現在看來，倘若當初是以體育署版本通過，中華體育總會昨天的動作，也必然會讓體育署的處境更為艱難。

在改革的路上，總是會充滿險阻，而國民體育法的修正，還需要更多關心體育的朋友一起加入，實質的讓我們單項協會可以從量變到質變，進而走向真正的現代化與產業化。

因此，國書在這邊也要再一次呼籲所有關心體育改革的朋友，改變台灣體育，就從加入開始！

各單項協會入會報名網址：
https://portal.cloud.sa.gov.tw/PeopleApply/PeopleApply",2017-11-06 20:08:53,https://www.facebook.com/permalink.php?story_fbid=pfbid02Xa7PWQPSw3cufZvkASRKoD4nntPdfwbCSGBaMrYmtnXDtnyS8TmPyURMwTTqKUjQl&id=566381323386617
2718,1713424742015597,今晚國書在天皇宮廟前廣場（東區振興路280巷30號）舉辦「台灣好政」重大建設與推動計畫說明會，歡迎大家前來！,2017-11-08 13:05:51,https://www.facebook.com/permalink.php?story_fbid=pfbid0gbEE3e7B6TLsobHt1MHXnhSRQRNKQgjEZecfdhmgQ8BzNcq23kXDUB7SvNuLkKXsl&id=566381323386617
360,1716480251710046,"體育改革進度透明化　國體法子法及相關會議研議進度上線！

在國民體育法的附帶決議中，有鑑於體育署過去在子法修訂上的慣性拖延，國書也明文要求體育署應於6個月內完成相關子法修正。然而，由於在相關子法進度與討論內容中，體育署未能與社會充分溝通，造成社會對於政府在體育改革推動上之疑慮，國書也在上個月於教育文化委員會中提出臨時提案，要求體育署應該要將目前各項子法的研議進度上網公開，讓所有關心體育改革的朋友都能了解狀況。

國書認為，不是只有單項協民主化、透明化、專業化，體育署能不能有更開放且現代化的行政思維，以及我們的體育政策是不是真的能夠有跨世代的充分討論，都是台灣體育改革的關鍵。

肯定體育署公開子法及相關會議研議進度的動作，體育改革，我們一起加油！

國書提案內容：https://goo.gl/Radvzd

體育署國體法子法修訂進度查詢連結：
http://www.sa.gov.tw:81/mailmsg/SportsLaw.aspx",2017-11-11 16:27:43,https://www.facebook.com/permalink.php?story_fbid=pfbid0nw3mLE47qvVuVxaCD2L7BtcABXdow6aHaLV9UiWNLr3oNab8HtDMAjHHQZ1yrYyvl&id=566381323386617
1026,1727068557317882,"偏遠地區學校教育發展條例今天終於完成三讀！

去年六月份我以教育文化委員會的召委身份排審「偏鄉教育條例」草案到今天，感謝所有參與這部法案審議的委員們在這段時間的共同努力，經過了一年半的等待，我們終於盼到了這一部以偏鄉教育為出發點的專法！

國書期待，透過這部專法的設計與後續的檢討，可以讓偏鄉教育環境獲得改善，也謹以這部法案獻給每一位在第一線從事偏鄉教育的朋友。翻轉偏鄉、教育平權，我們一起加油！

新聞報導：
http://www.cna.com.tw/news/ahel/201711210209-1.aspx",2017-11-21 20:13:46,https://www.facebook.com/permalink.php?story_fbid=pfbid0WevizANU6AmBjdcpMUkKwCHcnb21nFJHsUHcFheTZuGBvyyjgix8xNDRU8J6suWKl&id=566381323386617
785,1733037880054283,"這兩天，感謝有熱心的朋友分享了台灣滑水好手林芝韻疑似因為單項協會經費問題，必須放棄冬季奧運參賽機會的報導。http://www.storm.mg/lifestyle/360280

從推動體育改革開始，國書就不斷強調，除了單項協會的現代化，更需要改革的是體育署過往嚴重扭曲的功利式經費分配與派隊心態。

冬季奧運是冬季運動項目部分國際最高層級之綜合性賽會，而2018年仁昌冬奧報名在即，過去滑輪國手宋清陽因為單項協會打壓致使無法報名的憾事殷鑑不遠，國書也請辦公室同仁發文給體育署，請體育署必須要積極了解，並落實蔡英文總統體育改革、照顧選手之宣示，避免再有優秀選手因單項協會之行政決定讓參賽權益受損！",2017-11-27 15:38:33,https://www.facebook.com/permalink.php?story_fbid=pfbid0sxe3RMCNbCq4P18qKqhzcmUrG51Z86f6Qkgo8TZTXG5PLX6433MNXyWcRpED2S3Vl&id=566381323386617
2777,1734085056616232,「台灣好政」重大建設與推動計畫說明會中西區場次就在明晚！第二市場武德宮前廣場，歡迎有空鬥陣來！,2017-11-28 13:46:26,https://www.facebook.com/permalink.php?story_fbid=pfbid02VofwsY5wxfnjbyprsEokEDpkrB61kMyE7sJapVGFxYuLBZZ2PhHVmRK4o3hvSaiFl&id=566381323386617
536,1736514553039949,"日前，在國道三號發生一家三口因為拖板車爆胎而車禍枉死的事故。在後續的報導中，也指出了這台拖板車不僅是司機無照駕駛、還有超重、使用再生胎等問題。

但是，是什麼原因超重的大貨車可以在國道上奔馳肇事？我們的地磅站在做什麼？

經過國書進一步調閱資料才發現，目前國道44個地磅站，平均停磅的比例高達38%！雖然在昨天交通委員會的質詢中，交通部國公局局長解釋部分時段停磅是為了避免影響行駛效率，但是國書認為，多一次檢查，就少一分因車輛過重而導致不幸的機率，而人力不足更不該是國公局的藉口，為了節省人力而放水行車安全，這是絕對是本末倒置。

針對國道地磅停磅比率過高的問題，國書也要求交通部必須要在一個月內提出改善的規劃，同時我也要再一次提醒交通部，「安全，是回家唯一的路」不該只是口號，而必須落實在交通部對國人用路安全負責的態度！",2017-11-30 16:08:15,https://www.facebook.com/permalink.php?story_fbid=pfbid02y1YGdgVm3gXiKXEcK6ar4YTAfjLG3xN694gjP1Am7sxUimdvgaiHvYJzmJ1iLMmRl&id=566381323386617
538,1737687276256010,"今天，是運動產業發展條例修正生效日，為了瞭解體育署在後續施政上的推動規劃，國書也特別邀請了體育署綜合規劃組的王漢忠組長，前來共同討論，希望讓這次的運產條例修正可以真正能夠對產業提升助益，不要再讓運產條例重蹈過去只是徒具形式的問題。

在與體育署的意見交換中，國書也具體提醒了體育署可以馬上就針對相關的商業登記類別的建立、電子競技業與運動經紀業的定義明確化以及從運動傳播資訊出版業的獎勵落實開始，讓國人感受到體育署這次在運動產業的領域是要「玩真的」。

國書期待，配合運動產業條例第六條的運動產業政策計畫的擬定，體育署這次可以更積極的向產業界與年輕世代請益，搭配本次修正的第七條關於公部門與國營事業協助投資職業運動的設計，讓台灣的職業運動可以更進一步的發展，也讓我們基層的選手們可以看見未來，而不再只是一閃即逝的台灣之光！",2017-12-01 18:31:15,https://www.facebook.com/permalink.php?story_fbid=pfbid02xf1Sfac8WgSKxNjkR4nWjBwTX3hpAKhJhoNDeVynxQKd3dUieqmRHaLitDVgRGAAl&id=566381323386617
2736,1746046945420043,去年我們爭取教育部補助向上國中中庭改善工程，今天完工落成啟用。受校長之託，寫下向揚二字立碑，祝向上飛揚!,2017-12-09 13:35:01,https://www.facebook.com/permalink.php?story_fbid=pfbid02YpxKGpSDzZ7Aj6Z1NUTZAdVPDuNJs91uDnHvm39sBjg1BYSm1Tq8okVgW9uTQ358l&id=566381323386617
2561,1746086148749456,今年的國中女子足球聯賽即將在明天開踢，而我們台中五權國中女足隊也將遠赴高雄出征，放上國書之前到五權國中為這群小小健兒們授旗的照片，預祝旗開得勝！,2017-12-09 19:20:00,https://www.facebook.com/permalink.php?story_fbid=pfbid02ErYWQMVQhuDRdnMvx77KPqAbinvwKR9YrgSLvUiuC2xKrTAgt8i8y9Dru9ckgJQal&id=566381323386617
3058,1746390628719008,柳川聖誕點燈，滿滿人潮，中區翻轉中!,2017-12-09 21:57:20,https://www.facebook.com/permalink.php?story_fbid=pfbid02kZmcF1p9cVHdaHcbuWFrioX58DaFAjPDaMQ1J7EexiWxeHfUr66oPpwMgEts6Ycjl&id=566381323386617
