index,post_id,text,time,post_url
113,142276732118552,"「牠死了！我不知道怎麼跟小孩說，小孩一直很希望牠能平安躲進山林裡⋯⋯」朋友傳來訊息問我。她的女兒一直都很喜歡中大型哺乳動物，所以她們去動物園、去搭賞鯨船、家裡也養著貓貓。

其實，這起新聞事件對於許多大人來說，其震撼和「想不到」的感受，必然也不亞於小孩。此外，就算已經有無時差的網路新聞，但目前的資訊也不見得是百分之百可以信任的。所以，如果心裡有悲傷、疑惑和憤怒，那今天晚上先陪孩子讀一讀繪本吧！這些繪本當然也可以是大人給自己的陪伴。

故事中，人和動物之間的關係是一種典範，也就是：不同物種之間的相處樣態，原來可以是彼此互相依賴和溫暖的。只是理想的樣態在這次的狒狒死亡事件之前或許不被人所關心，但可以期待的是，大家都將在這次的狒狒事件中，學會新的觀點和方法以做為日後的學習起點。

我所分享的這些繪本故事也暗示了「人永遠不能自以為是地放大了自己的位置」。如果心中沒有對於其他物種的認識和情感，那麼這樣的事件只會一再發生----但這卻也是身為一般人的我們，最不想看到的。真心期待在人與動物之間，有越來越良善的互動關係，以及公務機關在這類型事件上更完善的機制盤點和政策說明。

#繪本媽媽
#親子共讀
#議題繪本",2023-03-27 23:29:56,https://facebook.com/peiyu901/posts/142276732118552
200,142849185394640,"孩子的成長，需要細心的呵護與關愛。在口腔保健方面，更需要家長們給予足夠的重視，每天的牙齒清潔以及均衡的飲食，都是培養孩子健康口腔的重要習慣。

定期的牙齒檢查是不可或缺的一環，及早發現，才能更有效解決口腔問題。

為了協助家長更好地照顧孩子的口腔健康，衛福部與牙醫師全聯會攜手，推出「2023兒童口腔健康週 - 孕婦嬰幼兒愛心親善牙醫院所」活動。

112年4月1日至4月15日活動期間，懷孕婦女、嬰幼兒及15歲以下青少年凡持健保卡至貼有「孕婦嬰幼兒愛心親善牙醫診所」貼紙之牙醫診所/醫院牙科部就診，可享免掛號費之福利！

爸爸媽媽連假出去玩之後，別忘了帶小朋友去檢查牙齒喔！",2023-03-28 18:47:58,https://www.facebook.com/peiyu901/posts/pfbid0dmdqXAGgx9dtCKu7AtaAA8NTqybYsTzmpjiPFyK2KVG4cTL5FSkUWVRiszG1A2nml
93,144015028611389,"我參加了國際特赦組織2022年度人權報告記者會，雖然台灣已經將《兒童權利公約》國內法化將近十年，但令人遺憾的是，仍有許多兒少在日常生活中受到不當的對待。

最近一則新聞是，在一個校園活動當中，三百多名小學生被要求罰跪，甚至踹桌子、罵髒話等荒謬情事。為了改善這個問題，我們需要從根本上改變現狀，創造一個能夠支持兒少健康成長的環境。透過提供支持服務、改善教育制度和學校環境，及加強法律和社會保障制度等方面，這些都刻不容緩。

此外，數據顯示，2021年兒童和青少年遭受身心暴力的事件不斷增加，而超過53%的施虐者是他們的父母。我可以理解，在育兒的道路上，不可避免感到孤獨、沮喪。此外，在疫情肆虐全球的這幾年，爸媽的壓力可想而知，不論是經濟生活或是個人生活都受到極大的影響。

因此，如何在為家長提供管教上的配套支持系統，以及良好的教養喘息服務，將會是我接下來努力的目標。因為，對我來說，教養生活的展開，是讓每個孩子用自己的方式發光，同時也是讓爸媽再找回自己生命力量的起點。

所以，在這樣的情況下，我們應該將正向教育取代打罵。透過建立相應的教育制度，幫助家長了解如何用適當的方式教育孩子，保護孩子不任何形式的施虐。我們有責任和義務保障兒童和青少年的權益和身心的健康成長。我也會持續努力，為兒少建立一個安全、健康的成長環境。",2023-03-30 11:56:30,https://facebook.com/peiyu901/posts/144015028611389
4,144193458593546,"很多朋友關心的公視法修法草案，史哲部長說文化部正在努力，希望明天能通過行政院會，盡快送入立法院。聽到這消息，我相當開心，除了同步在寫自己的草案外，修法前夕，我更與部長一同深入討論公視有關兒少節目製播的問題與困境，期盼修法能帶來一些正面改變：
　
⓵ 公共頻道應大幅增加兒少節目製播：
台灣兒少節目播映時數僅佔總時數約10%，嚴重落後鄰近的新加坡（37.5%）和日本（23%），兒少節目自製率上，台灣也很低、僅有9%，美、法等國幾乎都高於50%，韓國更是接近100%，相比之下，台灣真的落後有點多。

我認為台灣囝的成長過程中除了食台灣米、啉台灣水更加愛收看台灣節目。

公視的自製兒少節目，其實品質不錯，像出發騎幻島、下課花路米等更屢獲金鐘獎，公視作為公共媒體的重要成員，我很期待它能作為媒體表率，優先提高兒少節目自製率及播映時數，增加兒少影視上的良好選擇。

⓶ 打造兒少節目網路收視環境：
就跟國際一樣，近年來台灣兒少的收視習慣大量轉往網路串流平台，英國的BBC便因此，將旗下的BBC Kids 轉為網路平台，去年更在台灣上架，我呼籲文化部與公視，要注意這個習慣轉變的趨勢，朝向設置適合兒少的網路串流平台／APP，讓優質的自製節目有更多收視機會。

我很高興提出後，聽到部長直接回應：「事實上我們都支持兒少節目應該要大量增加」，因為這是在文化紮根。

部長除了大力認同我的建議，並承諾如果本次公視法修法可以讓公視經費健康化，首要就要希望鼓勵兒少節目大幅增加，這也是作為一個公共頻道首要的責任！

現在大家都知道，是一個平板、一個手機在看節目，而不是在電視上看，所以兒少的網路收視環境確實也該作為強化的首要！

我也和部長提到，兒少收視除了現有節目外，還有兩個影響同樣深的面向需要配套改善：

▶️ 研擬兒少節目製作人才培育機制：
前面提到台灣兒少節目自製率低的問題，其實不僅是公視，許多電視台都面臨此狀況，文化部雖然已有提出「兒童節目製作培訓類」項目的補助，但一直難有成效。所以我建議部長，可以考慮分析民間成功的案例，納入一開始就該有專業「孵育」的概念，跳脫原本只補助經費的想法，以此提出真正有效的兒少節目製作人才培育機制，才能確實解決人才不足及斷層的問題。

▶️  一個月內研議將本土語言節目納入兒少教育資源：
公視兒少資源網推出不到一年，已提供多部華語節目並和校園共同開發多份教案，迴響良好。因此我和部長提到，公視台語台、客語台、原民台等電視台之台灣本土語言節目也應被一起納入，文化部並應與教育部合作，積極鼓勵各級學校、教師開發相關母語教案。

史哲部長現場回應，培育機制的大環境問題他了解、將會協助文化部檢討改善，至於公視兒少資源網納入本土語言節目，真的是個好事，他會來努力，也會和教育部溝通，一個月內提出研議報告。

兒少的影視環境需要更多人一起來關注及支持，和我一起努力，讓文化紮根，讓教育紮根。",2023-03-30 17:58:06,https://www.facebook.com/peiyu901/posts/pfbid0Wu8R6rtBAt4KHAExW2dr6MEPKqryXiAqiVA7wca9FLbQNxrfTC3KRZRdsAVo2qxHl
75,144664988546393,"⚽ 續辦青年足球聯賽 協助重整足協財務 

「足球爸媽圈」炸鍋了！原來是中華民國足球協會上周五（3/24）以「財務艱困」為由，宣布取消已舉辦了三年的青年足球聯賽。「足球爸媽聯合應援團」急著向張廖萬堅委員、劉世芳委員、與我的辦公室反映，表示這將嚴重戕害基層足球。

因此，我們今天邀請體育署一同召開記者會。我有兩點訴求：

1. 續辦青年足球聯賽。
2. 體育署應協助足協重整財政。

體育署副署長洪志昌今天承諾，將提供賽事所需補助，也就是說，本年度的青年足球聯賽確定續辦。

青年聯賽是台灣少見的真正意義的聯賽形式，在足協近三年用心辦理的青年聯賽中，除了提供了俱樂部球隊發展重要的舞台，也成功做出了校隊與俱樂部可以共存發展的實證，也是近年台灣足球青訓發展的關鍵政策，讓眾多台灣球員最後的足球生涯紀錄能夠不再停留在12歲。我全力支持青年聯賽的續辦，使年輕選手們的參賽權真正受到保障。

此外，我認為體育署應依國體法賦予的監督責任，確保足協財務人事健全，並落實財務查核與透明，並向社會大眾公告。希望足協能夠訂定出健全穩定的聯賽機制，讓所有的聯賽不再因任何組織人事更改而中斷取消，以及限縮補助，影響所有踢足球孩子的權益。

我實在不忍心看到愛踢球、努力練習的年輕運動員失去舞台，希望今天在相關單位的協力之下，能夠還給孩子們一個單純快樂、並且真正需要的舞台。

堅持．張廖萬堅
愛信任-劉世芳
足球爸媽聯合應援團",2023-03-31 10:36:41,https://www.facebook.com/peiyu901/posts/pfbid0UPfFmfwGk2hCZgG4t4UKwJXs6FGfrDhsBeL3vz99eUa55fjrSS6XAcFy2MNbLGkNl
84,147520554927503,"兒童節跟大家分享一個歷史故事。
二戰前的一個雨天，一位小男孩在街上迷路，遇到許多飢餓和貧困的孤兒，他感到十分難過。這個幼小的男孩開始有了夢想，希望能建立一個沒有悲傷的王國，讓每個孩子都能獲得他們應有的權利——這位男孩就是後來的兒童權利之父柯札克。

戰爭爆發後，柯札克作為軍醫四處奔波，但他對兒童的關懷從未減少。
每個晚上，他都會免費為窮人家的小孩看病，默默地守護著他們。

二戰結束後，他離開醫師的身份，成為一間孤兒院的院長。

這間孤兒院與眾不同，他們擁有議事制度，孩子們會選舉議員，一同制定規則並負責管理自己。違反規定也會有小朋友們組成的「兒童法庭」，自己裁決如何懲罰。

不過，兒童法庭的最高原則是寬恕和原諒，因為柯札克希望透過這樣的方式讓孩子們明白，學習從錯誤中學習，在錯誤中爬起來，過程中的成長才是最寶貴的。

柯札克的善良和關懷曾經照亮了這個世界，也提醒了我們，教育及兒童權利的重要性。

不是每個人都是幸運的人，能夠擁有幸福的童年，有一些人一生都受困在童年創傷之中。正因為不是所有人都能擁有良好的心理支持系統，能陪伴他們度過人生當中大大小小的困境，所以為兒少建構一個安全成長的環境，也一直是我行動的初衷。

在立院的每一天，我將兒少作為監督、修法的重點，未來我也會針對兒少推動更多的法案，因為我相信，只要持續努力，必定能為兒少建構一個安全成長、自在健康的環境。",2023-04-04 17:26:30,https://www.facebook.com/peiyu901/posts/pfbid0AEmPazBCB16K2oaGq2t1uD49HaergpGJ2Xkga1dPf7MyhEbG6ZW5n84CxB8iYdjml
7,148952911450934,"改善特教老師勞動環境，讓特教學生擁有充足照顧與學習！

距離《特殊教育法》上次大修已14年，最近新一波修法即將啟動！

上週行政院通過特教法修正草案，提出許多重大改變，但在特教學生權益與特教老師勞動環境上，我認為還有許多進步空間，所以在今日立法院舉辦的修法公聽會上，我懇切地呼籲教育部，務必以特教學生權益為核心來推動這次修法：

特教老師常面對過高的生師比，以國立高中為例，有些學校中，一位的特教老師，一人就得負責幾十位、甚至高達百位的特教學生，且老師除了教學及協助，還要處理許多報告、心理評量與行政庶務。作為一名曾經的教師以及現在兩個小孩的媽媽，我完全無法想像一名老師要怎麼樣照顧這麼多的特教學生，站在家長的立場，我也不認為在這樣的情況下，學生能在學校被好好照顧，因為老師早已無力負擔。

另一方面，現在特教學生的鑑定與心理評量也多半交由校內特教老師負責，一份報告光是進行各項測驗、家長訪談、入班觀察、評估會議、彙整資料、撰寫報告等，前後可能需要花費將近9小時的時間，放在已要處理上課、備課、協助學生、研習等工作的平日，可能需要數天課餘時間才有辦法完成。部分縣市需鑑定的量早已超出特教老師的負荷，不僅導致老師原本教學時間減少、甚至可能影響鑑定的品質，最後權益受到影響的仍是學生。

這些勞動環境惡劣的現況，常導致特教老師身心俱疲，愈努力盡責往往愈快被消耗殆盡，離職或轉任普通教師的比率居高不下，好的老師是否能留下完全靠運氣。因為老師不足或忙於評鑑，導致原本教學、陪伴時間減少、學生學習品質下降，這已是本末倒置，高流動率更造成師生間需花費更多時間來認識彼此，這樣的情況對學生、老師、家長來說都是有百害而無一利，也都是大家所不樂見的。

為了改善問題，我提出二項提案，呼籲本次修法應：
1. 明定班級學生人數及生師比，不再以「為原則」模糊帶過，因為唯有特教師資充足時，特教學生才有可能得到充足的協助及學習！
2. 身心障礙學生的鑑定應由專業心理評量人員來進行，讓心評工作專業化、專門化，強化品質，並盡可能減少特教老師高度過勞負擔的問題。

這二項訴求都會包含在我將提出的特教法修法草案中。特教學生需要更多且更具專業的支持、陪伴與協助，特殊教育是一個不容易的專業，照顧好特教老師的勞動環境，才有可能使特教學生擁有充足照顧與學習，唯有兩者都能被法律妥善照顧，第一線教學狀況真的改善了，我們的特殊教育才能夠朝向正確方向持續走下去。後續特教法審查時，我將持續努力爭取特教師生的權益，期盼看到這篇貼文的你，能一同與我關注特教法修法！",2023-04-06 16:05:02,https://facebook.com/peiyu901/posts/148952911450934
163,149719044707654,"感謝立院好同事 立法委員  羅美玲 邀請我參加今天的「健康Champion能量傳遍Health For All」活動，賴清德副總統也率先響應簽署加入本活動。希望透過這次活動，能讓更多人關注身心健康，保持身心輕盈。

這次活動以各立委團隊為單位，預計共減重220公斤。活動結束後，我們將驗收健康成果，將相應數量的健康營養和運動物資贈送給需要的社福和育幼團體。

多年來我一直有想要減脂的念頭，卻總缺乏執行的動機。

今天在會場，我特地向國健署副署長賈淑麗請教了飲食和運動的秘訣，她告訴我兩個關鍵：「飲食168」和「日行萬步」。

我已經和先生約好下班後一起去慢跑，邀請大家也一起接力進行「健康Champion  能量傳遍 Health For All」，動起來，一起為身心健康努力！

莊瑞雄 
洪申翰 Sun-Han 
趙天麟 
吳思瑤 
高嘉瑜 
護理立委 陳靜敏 
何志偉 
鍾佳濱",2023-04-07 16:34:18,https://www.facebook.com/peiyu901/posts/pfbid0ReDNK1fRANX56cJPizE7zn2dQemHtdpV9xHmtPVNJHHCNdWSTE2j5KqowzxcLpPQl
108,150566454622913,"在當立委之前，我的其中一份工作是在課程講座中、在家長讀書會中，跟家長和教師們分享如何透過不打不罵小孩還可以管教小孩。但是說實話，不打不罵的管教，真的很不容易，是一個要持續修鍊的功課，無法一蹴即成！因此只要有人願意一起努力，我都感謝萬分，只要有多一點人願意對小孩好，那麼離友善小孩的社會環境，就會越來越近。

今天很開心參與了新竹在地的朋友們所舉辦的430不打小孩系列活動的開幕式，活動後走進書展區，我很雞婆的忍不住跟李妍慧和陳建名推坑好書，很開心大家都帶走了覺得適合自己和孩子的兒童人權好書。

這場活動是由人本教育基金會與昌禾教育基金會、 大魯閣湳雅廣場再度攜手合作，以「兒童人權是啥物」為主題，舉辦「主題書展」、「主題電影放映」、「主題座談」等活動，給予父母、社會各界有更豐厚的思想支持與對話機會，讓「兒童人權」不只停留在呼籲的階段，而是真正落實在生活中的每一天。

而我在立法院中也將持續協助督促教育部及衛福部，在相關育兒政策規劃中，為家長積極爭取友善的育兒環境及支持系統，讓所有願意生育孩子的家庭都能在有愛的社會環境中，陪伴孩子一起長大。

李妍慧 Yen Hui Lee
陳建名
北區超正。派  我是楊玲宜
新竹市議員 曾資程
人本教育基金會新竹辦公室",2023-04-08 22:18:33,https://www.facebook.com/peiyu901/posts/pfbid02exDeTDLzY76oRNUrDUQFXzwFaGEwztcFCQCWpTqyVHsaqh8Gg28wAJAPxugJkYgal
0,151886391157586,"校園霸凌及不適任教育人員，是許多學生及家長心中的痛。

這三年來，持續傳出的校園案件，包含最近大家關注且痛心的豐原高中學生輕生案，都一再提醒我們，校園中仍有許多問題亟需改善！

今日教育部也在立法院對此進行專案報告，我針對兩大重點，潘文忠 部長提出六個教育現場迫切需要改善的方向，要求教育部盡快處理，別再讓憾事持續發生：

⚡️重點一：「老師對學生」霸凌案件處理機制須有重大改善

➀ 應優先以霸凌處理機制嚴謹調查，避免以不當管教淡化規避

2020年7月，老師對學生的霸凌終於納入「校園霸凌防制準則」，但到去年底為止，通報的649件中，只有35件成案，成案率僅5.39%！許多家長及民間團體都和我提到，這個超低的成案率多非誤報或誤判，更常是因案件只被當作懲處輕微的「不當管教」來處理，甚至連不當管教都不成立。

教育部也清楚霸凌處理機制其實更為嚴謹，所以我和部長提出，應要求全國學校，校內發生師對生霸凌案件時，應優先以霸凌角度「調查、判斷及處置」，避免以「不當管教」淡化規避！

➁ 霸凌的「持續」要件應有明確參考，避免學校過度嚴苛檢視

「校園霸凌防制準則」定義霸凌行為時提到了「持續」的特性，但對於「持續」的想像，各地方、各學校、各老師的標準都不同，常導致學生、家長、老師無所適從。更嚴重的問題是：很多霸凌案件常被「過度嚴苛檢視」，甚至還有學校提出，即使老師每次對學生的行為都判定是霸凌，但只要「一個月未達三次以上」就不算霸凌，這種說法對於曾身為老師、現在是兩個孩子媽媽的我來說，真的難以接受。

所以我要求教育部，應對「持續」要件提出明確、全國一致可依循的參考，且應限制學校不得過嚴檢視。 

➂ 師對生權勢關係下，應有不同於生對生霸凌案件的處理機制

每次發生師對生霸凌案件，一定會伴隨對調查可信度的質疑，因為當霸凌行為人是老師、甚至是主任、校長時，大家很難再去信任校方主導的調查和判斷。再加上師生嚴重不對等的權勢關係，甚至連學生初期求救都可能被教師以其他理由擋下，其他學生的出面作證也可能遭到教師、校方的威脅打壓，以上問題都顯示現行生對生霸凌處理機制不適用於師對生案件。

所以我要求教育部修正霸凌防制準則，針對師對生霸凌做出區隔，不再直接套用生對生處理機制，應考慮師對生霸凌案件的複雜度、壓迫度、傷害度，設立更完整的處置機制！

⚡️重點二：學創人員培訓規劃要完善！不適任者應納入資料庫！

➀ 重新規劃培訓內容及時數，落實輔導教育人員應具之內涵

不論是豐原高中學生輕生案，或是中山女高禁穿緊衣褲案，都顯示校園中部分學創人員出了問題，不僅未能達成輔導教育、正向管教、營造友善安全校園、推動校園霸凌防制等任務，反而還成為校園霸凌和影響校安的源頭！

我深入研究後發現，很大一部分問題來自其培訓的嚴重不足，現在學創人員培訓總時數僅70小時，且其中學生權利、輔導諮商技巧、正向管教的關鍵專業技能，居然都僅有各4小時的培訓，根本不可能培育出這個職務真正應具備的輔導管教能力！

我要求教育部要深切檢討這問題，並以落實學務創新所需「輔導教育人員應具內涵」為根本，重新規劃必須有的培訓內容及時數，讓更多學創人員能在校園發揮正確的效能。

➁ 學創人員管理與懲處規範應更明確，確實維護學生權益

學創人員現行的懲處機制相當模糊，目前規範的「處理校園安全事件或學生事件失當」、「對學生之輔導或管教，方法失當或未盡職責」等，光文字就有許多爭論空間，不僅造成校方、老師、學創人員執行判斷上的困難，更重要的是，學生權益也無法受到保障，此已和推動學創人員的原本目的背道而馳！

為了不讓原本美意變傷害，我要求教育部應對學創人員的管理與執行，制定更詳細、明確、確實維護學生權益、以學生為本的指引。

➂ 少數不適任學創人員應納入資料庫，學校進用前必須查詢排除

學創人員是以「勞動契約」進入校園，若有不適任行為，除非是刑事、兒少等案件，才可能被相關法律資料庫找出，否則解聘後還是可能再次被聘任！在教育部的規劃中，學創人員是輔導教育人員的一部分，因此其中少數不適任者自然也該納入不適任教育人員資料庫中，且學校在進用前，應比照進用教師等教育人員的方式，先查詢資料庫以排除過往已明確不適任者！

孩子們受傷、甚至失去生命所帶來的傷痛，不該只停留在個案層面，作為一位從教育現場出來的老師及家長，我清楚知道，如果我們沒有盡快改善制度面、執行面的各種問題，這樣的事件只會再次發生，過去幾年我們已反覆看到太多眼淚與心碎，這也是為何今天質詢時，我會如此沉重拜託潘部長，要求教育部加速改善。

💪校園應是學生身心健康成長、建立自我發展的安全場域，作為一位母親、一位長期關注兒少議題的立委，我會持續努力，期望能和關注學生權益的夥伴一起打造更適合所有孩子生長的環境。",2023-04-10 20:42:29,https://www.facebook.com/peiyu901/posts/pfbid02a7SUhPZXY5mgPNJr7T2X8EHsC6fJY8VLzSLm8ZKhSFEMbDThKXAJ5NKJu5QxjS8nl
173,152211864458372,"#市場通路惡性競爭
#文化產業的未來在哪裡？

這一年來，電商通路大打書籍折扣戰，初期電商自行吸收折扣，但近期與出版社的年度換約中，要求出版社直接讓利，嚴重衝擊出版圖書產業。

電商通路的大幅折扣，也同步壓縮了實體書店的生存空間與書籍出版的多樣性。

當社區生活中再也沒有書店、暢銷書排行榜逐漸單一，我們又該如何期待具備思考能力的公民社會？

有鑒於此，本次的公聽會將邀集產、官、學，以及讀者四方代表，共同商討如何創造多贏的局面。

我們呼籲政府盡快針對此議題展開討論與研議，也希望讓社會大眾了解，為什麼我們應該關心出版圖書產業，以及我們將打造什麼樣的共同未來。

🌟不便到場的朋友，可以在粉專收看直播
https://www.facebook.com/peiyu901

公聽會直播時間：2023年4月11日 14:00",2023-04-11 08:20:08,https://www.facebook.com/peiyu901/posts/pfbid0TF3QG3YkSSMChSpigK9BMUKuBSFLfNQCyTycDkvebhSrtzwb8rW3Fsss7tttUK9Ql
