index,post_id,text,time,post_url
1025,1112318372144736,"長期以來政府對於原鄉土地的分區管制過於制式，毫無因地制宜的土地使用分區規劃，導致原鄉建地不足、房舍無法取的使用執照。
今天針對「蘭嶼居家護理所」設立問題，邀集內政部營建署、消防署、衛福部、原民會共同研商「護理人員法施行細則第7條」的修正問題，終於達成修正共識，增列「位於原住民族地區（部落）護理機構，得以建築師或結構技師等專業鑑定報告，取代建築使用執照」之條文內容。也作為衛福部未來於部落規劃長照機構之參考依據。相關內容將於九月初做法規修正預告後施行。",2016-07-27 17:03:17,https://www.facebook.com/giwas888/posts/pfbid02mWvPzbbSGy8YARbW4t3WKKYGkxhdW3nTEaxicBsBUM2xdTQZviLcXYHfegSiAv18l
1528,1112340645475842,"當初原本只想為偏鄉提供幼兒教育設置的教保中心，現在竟然成為擁有部落特色的教育場所，未來更計畫能推廣到更多部落。
http://udn.com/news/story/3/1853735",2016-07-27 17:59:50,https://www.facebook.com/giwas888/posts/1112340645475842
1641,1112443555465551,謝謝美園教保中心的每一位同仁們，因為你們，讓民族教育紮根。未來還需要你們提供更多的經驗做為其他部落學習交流，與教育政策制定的依據。,2016-07-27 21:36:44,https://www.facebook.com/giwas888/posts/1112443555465551
1130,1112932738749966,"原民台無線數位頻道開播。
與會的行政院林錫耀副院長說要「照顧」原住民，我必須嚴正的說：原住民族需要的只是公平正義。
今天參加這個活動，只是「暫時性、臨時性」的解決原民台訊號傳輸的問題，原住民電視台還是寄人籬下（公視）的孤兒。我很遺憾，行政院副院長今天應該針對「原民台專屬無線數位專屬頻道」的建置案提出政策方向，但是並沒有。顯然這只是他所謂的「照顧」而已，公平正義還是要靠我們自己努力爭取。",2016-07-28 15:39:46,https://www.facebook.com/giwas888/posts/pfbid027hywH2WvciPyJJ89X44FvDQsxjxvSajiFWF52L2bAZbhv2qMCMEVxNh6b48RZu9Bl
63,1113141968729043,"泰雅族大豹社戰役建碑  歷史現場巡禮

集合時間：105年8月1日，上午9點
集合地點：新北市三峽區「北114鄉道」大義橋（參閱附圖）

新聞稿

故國神遊…                                  
文/高金素梅

約三百多年前，我泰雅族從南投沿著中央山脈往北往東遷移。約一百一十多年前，在眺望所及的這片泰雅族土地上，發生了長達16年驚天動地的抗日戰爭。而現在我們站立的這塊土地，就是16年抗日戰爭的先鋒戰「大豹社戰役」的戰場。

擁有現代化武器的日軍，竟然在「大豹社戰役」的頭兩年吃盡苦頭，敗戰連連。吃了敗戰的日軍在附近設置了「插角隘勇監督所」監控大豹社，我前幾天走訪該遺址，現在只剩三顆大樹，現今的「插角派出所」所長告訴我，地方耆老說，當年派駐「插角派出所」的四名日籍警察，曾在一夜之間人頭不見了，被我大豹戰士出草了。歷史…，是如此的有張力！

上週再度走訪日軍忠魂碑的現場，下山後，遇見當年樟腦業工人「腦丁」的後代。他說，在山下路邊有個小廟「萬善堂」，當年大豹戰士戰死後遺體就是被抬放到此處，後來蓋了「萬善堂」，在漢族的意思就是無名塚。萬善堂旁邊有一座橋，上面刻名「湊合橋」，應該是「廟雖小，湊合著用吧！」的意思。歷史…，是如此的紮根在地！

1900年的大豹社是一千多人的大部落，1906年退到角板山剩不到40戶。抗日…，我們的付出是如此的慘烈。

今天，新政府在昔日殖民政權總督府（現總統府）召集55個原住民鄉鎮長，蔡英文要向原住民族公開道歉。昨天，新政府才拒絕在「促進轉型正義條例」納入原住民族。大家還記得陳水扁執政時提出的「夥伴關係」嗎？怕大家不相信，後來又辦一次「夥伴關係再懇認」，後來又加碼提出比自治更進步的「國中之國」，現在回頭看，只剩口號。
道歉也罷！夥伴也罷！政治的話語讓它隨風而逝！
我們忘掉政治人物的口號吧！

今天起，「大豹社戰役」建碑行動開始，今天起，追尋歷史正義的行動將陸續開展，大嵙崁戰役、李棟山戰役、太魯閣戰役……，台灣史將展現新視野。

活動流程：
0900-0930大義橋集合
0930出發往忠魂碑
1000抵達
1020告慰祖靈
1030發表談話
1140萬善堂",2016-07-29 10:00:00,https://www.facebook.com/giwas888/posts/pfbid02Rnj6v1bZumAzFUZzvV2DeB8Fv34FZzgwCYseSdj6YTkGEuDd5Nu9zgwosDqAf8Gql
1274,1114236885286218,8月1日是「原住民日」，這個週末各地區都舉辦了不同的活動，為的都是要捍衛原住民族的公平正義、文化傳承與產業發展。我在自己的家鄉和平區，我的心與不同角落的族人們同在。中午在與教育部林次長、台中市政府與和平區各級學校的校長召開推動和平區完全中學座談會後，我正前往第一所原住民族實驗學校「博屋瑪」小學的路上。,2016-07-30 14:47:31,https://www.facebook.com/giwas888/posts/pfbid0WFfX1kyNWCJjg4ajegTCbfnpCfcYwch6ehZmMo4xgsLNEaYYyTTv8PAgMS3UUSdFl
1208,1114304635279443,"下午與和平區長來拜訪比令校長，明天過後就將走入歷史的達觀國小，8月1日將正式成為第一所的民族實驗學校「博屋瑪」小學。
我想，這是邁向原住民族教育體系的第一步，也是最重要的一步。一所學校的改制，不只是談談理念而已，我看到了比令校長所帶領的學校師生的團結、堅持與努力，當然還要有家長的支持。謝謝你們，加油！未來我們還有很長一段路要一起走過。",2016-07-30 17:53:47,https://www.facebook.com/giwas888/posts/pfbid034EZDfDkyZmrNArBnLVQFu3wCvmaTgxpHtTzs2DRXdkm8rwymFAH4TA99p6PzjP4l
587,1115536838489556,"高金素梅回應蔡英文道歉2016/08/01
轉型正義的核心：「還原歷史真相」與「返還土地」

今天，蔡英文以總統的身份向原住民族道歉！
昨天以前，蔡英文的執政黨才在立法院以多數暴力將「促進轉型正義條例草案」排除了原住民族！

為什麼我要在八月一日「原住民族日」的今天舉辦「大豹社戰役建碑，歷史現場巡禮」？因為，我們要還原歷史真相，歷史真相就是「原住民族在日據時期遭逢有史以來最大的浩劫」，部落被日軍血洗，土地被掠奪。光復至今，政府仍不願面對原住民族抗日的歷史真相；被掠奪的土地，政府仍不願還給原住民族。

大家還記得陳水扁執政時提出的「夥伴關係」嗎？怕原住民族不相信，後來又辦一次「夥伴關係再懇認」，交換過兩次信物，後來又加碼提出比自治更進步的「國中之國」。現在回頭看，只剩口號！

轉型正義的核心就是「還原歷史真相」與「返還土地」，失去了核心，蔡英文今天的道歉只見優美的詞藻，仍舊是口號。",2016-08-01 15:10:18,https://www.facebook.com/giwas888/posts/1115536838489556
586,1115588358484404,"高金素梅回應蔡英文道歉2016/08/01
轉型正義的核心：「還原歷史真相」與「返還土地」

今天，蔡英文以總統的身份向原住民族道歉！
昨天以前，蔡英文的執政黨才在立法院以多數暴力將「促進轉型正義條例草案」排除了原住民族！

為什麼我要在八月一日「原住民族日」的今天舉辦「大豹社戰役建碑，歷史現場巡禮」？因為，我們要還原歷史真相，歷史真相就是「原住民族在日據時期遭逢有史以來最大的浩劫」，部落被日軍血洗，土地被掠奪。光復至今，政府仍不願面對原住民族抗日的歷史真相；被掠奪的土地，政府仍不願還給原住民族。

大家還記得陳水扁執政時提出的「夥伴關係」嗎？怕原住民族不相信，後來又辦一次「夥伴關係再懇認」，交換過兩次信物，後來又加碼提出比自治更進步的「國中之國」。現在回頭看，只剩口號！

轉型正義的核心就是「還原歷史真相」與「返還土地」，失去了核心，蔡英文今天的道歉只見優美的詞藻，仍舊是口號。",2016-08-01 18:26:53,https://www.facebook.com/giwas888/posts/pfbid02UvTDLV7eZCYgu4xGSwdqCBgvJLVPoqLt8LTTNXD8gNdHBpjXM9Bx32jTqKoza7ttl
1048,1116043795105527,"原住民族被蔡英文道歉的議題持續延燒，我希望更多的漢族朋友能夠去理解我們要的是什麼，原住民族在台灣這片土地上的歷史不被政府所重視，無形中，政府在一般民眾與原住民族之間築起了一道高牆。

要推倒這座高牆，我們都有責任，特別是我的族人們；從我上任立委的第一年，2002年北泰雅的反馬告國家公園運動，到日本靖國神社的還我祖靈運動...，要政府還給原住民族公平正義，唯有靠自己的力量。

希望未來從理解到認同原住民族的道路上，有越來越多的朋友加入我們。",2016-08-02 10:16:25,https://www.facebook.com/giwas888/posts/1116043795105527
21,1116581475051759,"拒絕自欺欺人、坦誠面對自己，才是和解的第一步《民報》2016/8/2
施正鋒 東華大學民族事務暨發展學系教授

蔡英文在總統大選的原住民族政策有九大項，其中第一項具體主張是「總統代表政府向原住民族道歉、積極實現轉型正義」。由實踐的經驗來看，真相委員會如果沒有調查權，縱有總統府的高度，高處不勝寒，注定四處碰壁。總統將政見中的「調查和解委員會」改弦更張為「原住民族歷史正義與轉型正義委員會」，原住民族相當納悶，為什麼漢人的促進轉型正義委員會可以有調查權，而原民的促轉會就不能有，難道這不是一種歧視嗎？難道背後沒有半點不信任的偏見？

如果道歉是為了要和解，然而，所謂的主流社會，目前有反應的多半是持反對的立場。儘管看法不同，如果願意進行對話，總是有相互了解及說服的空間；然而，要是字裡行間顯現嫌惡、甚至於輕蔑，只會把彼此的距離拉得越來越遠。目前，最普遍的說法是，做壞事的是荷蘭人、日本人、或是國民黨，為什麼要小英道歉？這當然不是她個人的錯，而是總統必須代表國家向原住民族認錯，而且她自己也同意、白紙黑字放在政見。

原住民族今天所遭遇的各種困境，根源長期的集體迫害，而墾殖者國家是最大的加害者，墾殖者則往往被描繪為無辜的受益者；如果說今天台灣有任何的開發成果，完全建立對於原住民族的土地掠奪、及資源剝奪。如果說國民黨接收日產是「不當黨產」，難道源自日本殖民侵佔原民土地為「官有林野」、中華民國政府順手納為「國有林地」，就不是「不當國產」？因此，政府道歉只是歸還山林的第一步而已。

另一種相關的質疑是，原住民族一向支持國民黨，憑什麼要民進黨政府道歉？這應該是總統府出面澄清的，因為蔡英文總統在道歉文表示，她是「代表政府道歉」，而非「代表國家」。我們寧願相信這是筆誤，或是撰稿人政治敏感度不夠、以致於用字不精確，畢竟，小英不是民進黨政府的總統、也不是漢人的總統而已，而是中華民國的總統。更不用說，儘管政權更替，國家必須概括承受所有的責任。

第三種說法是以土地歸還技術推託。其實，不談新港文書裡頭對於平埔族土地的偷騙搶、也不說對於平地原住民族土地的巧取豪奪，目前三十個山地原住民族鄉鎮就是族人的傳統領域，不要說族與族之間涇渭分明、連部落之間也楚河漢界。果真國家為了公共利益有必要限制使用，也應該徵收、或承租，豈可任憑政府機構、甚至於國營事業，繼續佔地為王？

最後一種說法是，除了外省族群、或是婚姻移民，當前絕大多數的台灣住民都有平埔族的血統，作為外來統治的受害者，憑什麼政府只向原住民族道歉？這種「大家都是南島民族後裔」的說法，不管有意、還是無意，實際上是一種的挪用，意思是說，「大家都是原住民族、有身分的原住民族沒有什麼特別的地方」。坦誠而言，有平埔族血統、未必就有平埔族的認同，更不用說會不會把原住民族當作兄弟。相對地，我們也可以問，95%以上的台灣人有更多的中國漢人的血統，豈不意味著有更強烈的中國認同？

拒絕自欺欺人、坦誠面對自己，才是和解的第一步，否則，再怎麼樣莊重的道歉儀式，本質上就另一次合理化支配關係，掩飾不了骨子裡頭被內化的漢人沙文主義。",2016-08-03 07:39:53,https://www.facebook.com/giwas888/photos/a.276865502356698/1116581475051759/
2051,1117350628308177,全台首間原住民族實驗小學成立。,2016-08-04 08:49:47,https://www.facebook.com/giwas888/posts/1117350628308177
1955,1118833048159935,花蓮萬榮鄉馬遠部落，布太一樣的生活站溪谷音樂會。,2016-08-06 15:12:25,https://www.facebook.com/giwas888/posts/1118833048159935
3,1119426384767268,"與所有的朋友們分享。
---------
真心期待，漢人社會願意傾聽原住民族的心聲《民報》2016/8/7
施正鋒 東華大學民族事務暨發展學系教授
近日，台灣教授協會的老友李筱峰針對蔡英文總統向原住民族道歉，先寫了一篇相當委婉的〈原民血淚豈是「道歉」了得？〉，不過，接受電子媒體訪問則很清楚是不以為然，隨後又衍生〈「泛南島民族意識」釋義〉。無獨有偶，摯友陳茂雄也有類似的看法〈要道歉也輪不到蔡英文〉，而早先的〈是誰挑起族群鬥爭？〉則支持民進黨立委段宜康的論調，主張『促進轉型正義條例』不應包括原住民族。其實，老同事陳翠蓮先前的〈轉型正義不宜包山包海〉、及年輕學者林雍昇〈威權體制的轉型正義不應與原住民族的歷史正義混為一談〉都有相同觀點。

原住民族朋友問我有何看法？其實，稍早已經針對某報社論〈「化及蠻貊」的轉型正義〉做了如下的感想〈表面上仁義道德、實際是背後插刀，充滿傲慢偏見〉，幸好老總是FB朋友，感謝容忍：
雖然「將心比心，感同身受」，只不過，解決之道竟然是「學術研究還原歷史真相與人事功過」、「描繪出台灣歷史全景的俯瞰圖」，難道，這樣就會「大家在相互包容下看到自己也看到別人」，「歷史已過萬重山」，而「『原權』的座標」就會自然浮現？
是的，「歷史演員已經離開的時空」，「轉型正義無法改變歷史，卻可改變觀看歷史的角度」，然而，要如何「建構未來的公義社會」，關鍵或許不在處罰、或是報復，而是在歸還原住民族背剝奪的主權、土地、以及尊嚴，更不說文化、語言、認同，否則一切都是空話。
沒有錯，「同為台灣的主人，民主體制就必須確保每個人的主人地位」。然而，當原住民族只能出現在『促進轉型條例』的註腳說明，還高談什麼「以相互尊重對方主體的夥伴關係」？又如何透過轉型正義工程來「凝聚走向正常國家的向心力」？
問得好，「原住民從政者積極為原住民的轉型正義發聲的多？」可知道近日，原民立委至少提了五個『原住民族轉型正義條例』又是如何被執政黨漢人立委訕笑、阻撓、說不要來亂了？
至於要問多少原民政治人物前往中國，這又跟推動原住民族轉型正義有多大相關？更奇怪的是，怎麼不問，有多少漢人政客前往中國絡繹於途？
最後，所謂「原住民族如果善用手上的民主權利」、「原住民族內部更可自我思索的方向」、「原住民族積極重振民族的靈魂」，雖然沒有直言，就是典型的怪罪受害者、不去譴責加害者，可惡之極！

有關於「原住民族的轉型正義應該與威權時代的轉型正義分開處理」的看法，或許是認為所謂的「歷史正義」與「轉型正義」的本質不同，自然要有不同的處理方式。其實，原住民族內部也有這樣的主張，唯恐會在清算黨產的過程中背書、同時又一次被邊緣化，認為應該另起爐灶；相對地，絕大多數的菁英則擔心在這一波的轉型正義潮流中搭不上這班車，時機稍縱即逝，如果不能納入『促轉條例』，至少也要有原民版的『促轉條例』，因此總共提了五個草案，包括不畏裹脅的民進黨籍立委陳瑩。

就轉型正義的相關文獻來看，特別是政治哲學，只有「歷史不義」（historical injustice）的概念，而「轉型正義」（transitional justice）就是要如何面對這些過去的不公不義，採取一些針砭的措施，包括司法審判、行政洗滌、真相調查、補償還原、及特赦除罪等，以便獲致正義，不管是罰式正義（retributive justice）、修復式正義（restorative justice）、或分配式正義（distributive justice）。因此，不管戰後、還是戰前的歷史不義，都是轉型正義必須面對的，將歷史正義與轉型正義分開處理，恐有便宜行事的嫌疑，也不合乎國際上學界的看法、及實務的作法。

至於蔡英文總統是否應該、或是有沒有資格道歉，最大的誤解是民進黨的原住民族政策一向採取人權途徑、應該去找國民黨算帳才對。誠然，在白色恐怖的過程中，不管原漢的菁英都無法倖免，然而，本土的朋友可能不知道，當下原住民族的困境，並非因為一般所謂「原住民族不爭氣」，而是長期政治支配、經濟掠奪、社會歧視、及文化消滅的結果；原住民族今天之所以被迫離開原鄉、流離失所，最刻骨銘心的是因為祖先留下來的土地被日本人充公、中華民國政府順手接收，如果清算「不當黨產」是理直氣壯的，難道不應該正視「不當國產」嗎？

畢竟，蔡英文總統不只是民進黨政府的總統、而是國家元首，因此，代表中華民國向原住民族道歉，應該是起碼的作法，如果丟給國民黨政府、一副事不關己的態度，那是不負責任的。事實上，台灣之所以有目前的經濟富裕，完全建立在剝奪原住民族祖產的基礎上，不講平埔族土地被漢人偷騙搶，光是木材輸出就替國家賺了多少外匯，而原住民族只能在林班地出賣勞力扛木，斑斑血淚，大家看不到，卻只有選擇認知下的諸多負面刻板印象，良心上過得去嗎？當國家是最大的加害者，作為不小心的受益者，如果要原住民自己去跟荷蘭人、或是日本人討公道，那是多麼殘忍的事啊？難道，我們彼此不是兄弟姊妹？如此的仁慈忽視（benign neglect），又遑論建立一個生死與共的生命共同體？

對於一些綠營的支持者來說，學者的論點必須合乎「政治正確」，也就是「可資使用」（usable），說穿了，就是要求當御用學者，跟國民黨差不多法西斯。因此，要是批評到民進黨，儼然就是罵到他們的祖公了，幾乎就要抓狂，接著要要加上一句「怎麼不去罵國民黨」，忘了民進黨已經是執政黨了。只能說，只要有這些沒有自主思想的狗奴才存在的一天，台灣的民主就還要努力。嫌い！

同樣是收服，手段還是有差別，殺人不見血。坦白說，今上跟你撒嬌，沒有人可以抵擋得了！有關於調查權，意思是說，「不當國產」先做行政調查再說。比較奇怪的是，為何「不當黨產」就不必先經過行政調查？不愧是談判高手，回到原點。清掃戰場，清潔溜溜！只不過，年輕人的相對剝奪感會越來越強，特別是經歷強烈的種族主義，更不用說窮盡行政手段以後的失落。儘管化解危機，然而，如果從鄉民的相互敵視的程度來看，幾乎就是以多壓少，社會和解釋徹底失敗，表示原漢鴻溝並未拉近。反正，被騙多次、學費繳多了，百毒不侵，就知道怎麼應付了。〈若望默示錄19: 20〉：
可是，那獸被捉住了，在牠面前行過奇跡，並藉這些奇跡，欺騙了那些接受那獸的印號，和朝拜獸像的那位假先知，也和牠一起被捉住了；牠們兩個活活的被扔到那用硫磺燃燒的火坑裡去了。

真心期待，漢人社會願意傾聽原住民族的心聲，不再冷諷熱嘲。",2016-08-07 11:14:45,https://www.facebook.com/giwas888/posts/pfbid02cWndNQZquK5nY3vPh62CozyU2gR1XWh9Tp3XW8zJsanbsxc1akRgETff43rsX26Gl
1946,1120110341365539,今天是父親節，獻上我最誠摯的祝福，祝大家父親節快樂！,2016-08-08 11:42:09,https://www.facebook.com/giwas888/photos/a.276865502356698/1120110341365539/
948,1120738377969402,"長照2.0政策說明將於近期在各地方政府展開，待訊息整合後告知大家。我們先聽聽長期關注原鄉長照學者的建議。

政大社會工作研究所所長王增勇：每一個原鄉都要有一個長照的管理中心，有這一個部落化的長照管理中心，才有辦法聽到部落的聲音，一定要尊重原住民族的意願，換句話說一定要跟原住民族討論過才能夠定案。

北醫醫學人文所助理教授日宏煜：原鄉長照涵蓋率及使用率低，應該要獨立劃分，主要有三大原因，服務機構設置通常有土地爭議，加上交通和服務件數等因素，照服員訓練後很少選擇原鄉服務，最後原鄉地區占地遼闊都是主要困境。",2016-08-09 10:51:12,https://www.facebook.com/giwas888/posts/1120738377969402
509,1121446104565296,"關於原住民族傳統領域，聽聽施正鋒老師怎麼說。
---------
一位法學界的朋友問：「施老師，您是我最敬重的學者，我只想問一個很膚淺的問題，原住民各族在數百年甚至千年的相互徵伐下，某族佔領他族的土地的情形極為頻繁下，您覺得定在哪個年代的返還土地範圍才符合原住民族的正義？論理根據是甚麼？後輩望求您的開視！」表上很千杯，聽起來卻是：「這麼簡單的問題，就問倒了，黑嘿嘿！」

這是我的回答：「雍昇 你問的是老調 原住民族自然有自己處理的方式 傳統領域是有變動的 如果有爭議 以目前的機制來說 未嘗不可使用共管 何況 我們現在說的是國家霸佔原住民族的土地 清清楚楚 不是指原漢、也不是指原原之間」。坦白說，連部落與部落的領域也涇渭分明，只是沒有漢人的白紙黑字登記方式，這是多元法制的精神，法界應該去念Mabo判例。

這是當年在賽德克族正名之際，與太魯閣族的和解，同意各自大致以南投、花蓮為領域，如果有重疊處，將協商共管。見證的還有布農族、鄒族、以及泰雅族的朋友。",2016-08-10 12:43:42,https://www.facebook.com/giwas888/posts/1121446104565296
1034,1121569324552974,"我請助理行文向中研院調閱一批日據時期的史料，中研院台史所卻告知，這些史料涉及個人隱私不願提供，我很想問，這些圖像內容都是有關原住民族部落或個人，收藏單位問過我們嗎！

小英要在總統府設立原住民族轉型正義委員會，沒有法律授予調閱權、調查權，一切都是空。這個案例是最好的證明。

只要這個政府站在「殖民者」的立場來處理歷史證據，原住民族的轉型正義就無法實現；我會繼續努力，還原歷史真相，讓殖民者面對原住民族「認錯、道歉、賠償」，這才是我們要的轉型正義。",2016-08-10 17:30:59,https://www.facebook.com/giwas888/photos/a.276865502356698/1121569324552974/
2084,1121995261177047,官大偉老師這麼說...。,2016-08-11 07:26:48,https://www.facebook.com/giwas888/posts/1121995261177047
757,1122743504435556,"連吃飯都搞階級。政府政策的制訂應以公平正義為原則，但是現在連吃飯都呈現著拉大階級差距的問題，非常糟糕的政策。

以台灣的有機農業而言，花蓮縣佔最大的比例，其次是屏東和台東，而這些高品質農業產區基本上都是偏鄉，或財政弱勢的縣市，這些地區的農產品多半都外運到都會去了，除了當地居民很少吃到，學校的營養午餐更不用說了，這些縣市的營養午餐費預算編列肯定無法與六都比擬，然而農委會卻提案要「六都學童吃有機 」。

在處理農產品問題上，「最短食物里程」才是我們要推動的政策方向，結果農委會推出的政策，卻是要繼續拉大食物里程，毫無節能減碳的概念，說「有機」，太膚淺。

吃飯也有城鄉差距 農委會提案 六都學童吃有機 https://goo.gl/bg7nn5",2016-08-12 09:59:31,https://www.facebook.com/giwas888/photos/a.276865502356698/1122743504435556/
1844,1123566264353280,原民會連族群委員聘任的事，都無法擺脫黨中央的束縛，族人還能期待什麼呢！,2016-08-13 10:24:08,https://www.facebook.com/giwas888/posts/1123566264353280
